,resto name,mark,location
881,Calle Ocho Marrakech,4.5,"4 Rue Moulay Ali, Marrakech, Marrakech-Safi, Morocco"
882,Ahlan Business Class Lounge,5,"Dubai, Emirate of Dubai, United Arab Emirates"
883,Le Marrakech,4,"149 T avenue du Marechal Foch, Les Mureaux, Yvelines, Ile-de-France, France"
884,OSMOZ Marrakech,4,"N_10, Avenue Mohamed VI, Marrakech, Marrakech-Safi, Morocco"
885,Restaurant Marrakech,3.5,"Avenue des Nation Unies, El Jadida, Casablanca-Settat, Morocco"
886,Le Marrakech,4,"7 avenue Philippe Auguste, Paris, Ile-de-France, France"
887,Marrakech,3.5,"Van Woustraat 119, Amsterdam, North Holland Province, The Netherlands"
888,Marrakech Restaurant,4,"Lagoona Mall, Doha, Qatar"
889,BED MARRAKECH,4,"Palais Soltan Avenue Mohamed VI, Marrakech, Marrakech-Safi, Morocco"
890,Restaurant Marrakech,3.5,"Rue Ain Nedjar, Mansoura, Tlemcen Province, Algeria"
891,Marrakech Restaurante Marroqui,4,"Calle Hileras 12, Madrid, Spain"
892,L'Etoile de Marrakech,4,"35 rue Gambetta, Chateaudun, Eure-et-Loir, Centre-Val de Loire, France"
893,Le Marrakech,4,"101 boulevard du Front de Mer, Bormes-Les-Mimosas, French Riviera - Cote d'Azur, Provence-Alpes-Cote d'Azur, France"
894,Marrakech Ground Zero,2,"279 Avenue Mohammed VI, Marrakech, Marrakech-Safi, Morocco"
895,JSet Marrakech,4,"Interieur du Complexe Prestigia Avenue Mohamed VI, Marrakech, Marrakech-Safi, Morocco"
896,The LOFT,4.5,"5 Rue Hajjali, Essaouira, Marrakech-Safi, Morocco"
897,Le Moon Marrakech,5,"Boulevard Mohamed V , Marrakech, Marrakech-Safi, Morocco"
898,L'Auberge de Marrakech,4.5,"21 Place de l Eglise, St.-Thibault-des-Vignes, Marne-la-Vallee, Seine-et-Marne, Ile-de-France, France"
899,Restaurant Le Marrakech,4.5,"221 rue Pierre Brossolette, Noisy-le-Grand, Seine-Saint-Denis, Ile-de-France, France"
900,Lounge Cafe Marrakech,4.5,"Pervomaiskaya St., 10, Yaroslavl, Yaroslavl Oblast, Central Russia, Russia"
901,PilPil Marrakech,4.5,"63 Rue Mohamed El Bakkal, Marrakech, Marrakech-Safi, Morocco"
902,Le Riad de Marrakech,4.5,"1 rue Emile Tabarant, Laroche-Saint-Cydroine, Yonne, Bourgogne-Franche-Comte, France"
903,La Palmeraie de Marrakech,4.5,"20 rue Lucie Diemer Duperret, Montbeliard, Doubs, Bourgogne-Franche-Comte, France"
904,Le Riad de Marrakech,4.5,"2 B avenue de Paris, Bonneuil-sur-Marne, Val-de-Marne, Ile-de-France, France"
905,Les Terrasses De Marrakech,4.5,"15 rue des Glacis, Ajaccio, Communaute d'Agglomeration du Pays Ajaccien, Corse-du-Sud, Corsica, France"
906,Be Live Collection Marrakech,5,"Sinon Parlez Avec Nous, Marrakech, Marrakech-Safi, Morocco"
907,Carmine's,4,"1043 N Rush St, Chicago, Illinois"
908,Workshop Kitchen & Bar,4,"800 N Palm Canyon Dr, Palm Springs, Greater Palm Springs, California"
909,The Ruined Garden,4,"Siaj, Sidi Ahmed Chaoui, Fes, Fes-Meknes, Morocco"
910,Casa di David,4,"Singel 426, Amsterdam, North Holland Province, The Netherlands"
911,Cafe Clock,4,"7 Derb Magana, Fes, Fes-Meknes, Morocco"
912,Horia - Oriental Natural Eatery,4.5,"Borgval 7, Brussels, Belgium"
913,Restaurant Marrakech,3.5,"Chemin Des Dunes, Agadir, Souss-Massa, Morocco"
914,Manuella Marrakech,4,"Avenue De Paris, Marrakech, Marrakech-Safi, Morocco"
915,Au Palais De Marrakech,4,"34 Route d Orleans, Montlhery, Essonne, Ile-de-France, France"
916,Les Jardins De Marrakech,3,"114 rue Elie Wiesel, Montpellier, Herault, Occitanie, France"
917,Le Palais de Marrakech,4,"Le Palais de Marrakech, Meru, Oise, Hauts-de-France, France"
918,Madison Marrakech,4,"232 Avenue Mohammed VI, Marrakech, Marrakech-Safi, Morocco"
919,Los Fogones de Marrakech,4,"Calle de Martinez de La Riva 19, Madrid, Spain"
920,Marrakech Cuisine,4,"Jl. Wolter Monginsidi No. 39, Jakarta, Java, Indonesia"
921,Le Marrakech,4,"5 Rue Jean Gresset, Amiens, Somme, Hauts-de-France, France"
922,Le Marrakech,3.5,"240 avenue de Stalingrad, Chevilly Larue, Val-de-Marne, Ile-de-France, France"
923,Le Comptoir Marrakech,4,"10 rue Praire, Saint-Etienne, Loire, Auvergne-Rhone-Alpes, France"
924,Pizzeria Marrakech,3,"Via Aldo Moro 1, Sciacca, Province of Agrigento, Sicily, Italy"
925,Soleil de Marrakech,4,"3 rue de la Juiverie, Nantes, Loire-Atlantique, Pays de la Loire, France"
926,Le Marrakech,2.5,"Block 324, Road 4041 , Building 1579, Manama, Bahrain"
927,Olive & Oil,4,"15 Chartwell Drive, Umhlanga Rocks, KwaZulu-Natal, South Africa"
928,Kazbar,4.5,"25-27 Cowley Road, Oxford, Oxfordshire, England, United Kingdom"
929,Azouma Restaurant,4.5,"4 Church Street, Canterbury, Kent, England, United Kingdom"
930,A Taste of Sahara,4.5,"103 Western Road, Brighton, East Sussex, England, United Kingdom"
931,Patrimoine Kabyle,5,"30 rue Nicolas Leblanc, Lille, Nord, Hauts-de-France, France"
932,Artezzan Restaurant & Bar,5,"Chester, CH1 1DF 33 Pepper Street, Chester, Cheshire, England, United Kingdom"
933,Sortie Club & Dining,3,"Muallim Naci Cad. No: 54, Istanbul, Turkiye"
934,Charrua Madrid,4.5,"Calle del Conde de Xiquena 4, Madrid, Spain"
935,Tangiers Mediterranean Food & Cafe,4.5,"2800 N College Ave, Fayetteville, Arkansas"
936,Restaurante Virtudes,5,"Praca Sao Tiago Nr 13 15, Guimaraes, Braga District, Northern Portugal, Portugal"
937,Chez Michel Et Hafida,4.5,"Stall 192, Marche Central, Casablanca, Casablanca-Settat, Morocco"
938,Restaurant Tresor Fes,5,"1 Derb Mokri, Fes, Fes-Meknes, Morocco"
939,Arabia Cafe-Restaurant,4.5,"Carrer dels Escudellers, 25, Barcelona, Catalonia, Spain"
940,Kalita,4.5,"31 Kalogera, Mykonos Town, Mykonos, Cyclades, South Aegean, Greece"
941,El Toro,4.5,"N_ 7 Front de Mer Agadir, Agadir, Souss-Massa, Morocco"
942,Le Petit Marrakech,4.5,"Route de la Pala, Bulle, La Gruyere, Canton of Fribourg, Switzerland"
943,pizza yassine,5,"54 Derb Dabachi, Marrakech, Marrakech-Safi, Morocco"
944,Allotangia,5,"Avenue Prince Moulay Abdellah, Marrakech, Marrakech-Safi, Morocco"
945,La Gambas,5,"43 Rue Mauritanie, Marrakech, Marrakech-Safi, Morocco"
946,Retro Burger,5,"Rue Mohamed EL Beqal 41, Marrakech, Marrakech-Safi, Morocco"
947,Umami-m,5,"Boulevard Mohammed 6, Marrakech, Marrakech-Safi, Morocco"
948,Les Caves Saint Clement,4.5,"5 Rue de la Liberte, Gueliz-Marrakech, Marrakech, Marrakech-Safi, Morocco"
949,Korean Barbecue,5,"Almazar Shopping Centre, Marrakech, Marrakech-Safi, Morocco"
950,Table d'hotes Riad Sara,4.5,"120, Derb Arset Awzel, Marrakech, Marrakech-Safi, Morocco"
951,Nr 8,5,"Jemaa El Fna, Marrakech, Marrakech-Safi, Morocco"
952,Le Labo Africain,5,"5 Av. 4eme D.M.M, Marrakech, Marrakech-Safi, Morocco"
953,Riad Jomana,4.5,"62 Derb Arset Aouzal, Marrakech, Marrakech-Safi, Morocco"
954,Riad Del Gusto,5,"28 Rue Abnaq, Marrakech, Marrakech-Safi, Morocco"
955,Rest'o Senegal,4.5,"Rue Charaf, Marrakech, Marrakech-Safi, Morocco"
956,Snack Bachar,5,"Rue Riad Zitoun El Kdim, Marrakech, Marrakech-Safi, Morocco"
957,Samakhouse,5,"Massira 1, Marrakech, Marrakech-Safi, Morocco"
958,Restaurant,5,"Boulevard Mohammed V, Marrakech, Marrakech-Safi, Morocco"
959,DELICES DADA,4.5,"6 Rue de La Liberte Gueliz, Marrakech, Marrakech-Safi, Morocco"
960,Le Votre,4.5,"70, 80 Bab Ftouh, Marrakech, Marrakech-Safi, Morocco"
961,Restaurant Janat,5,"10 Hart Soura Medina, Marrakech, Marrakech-Safi, Morocco"
962,Patisserie Jaouda,4.5,"Rue de la Liberte Gueliz Marrakech, Marrakech, Marrakech-Safi, Morocco"
963,Shawermaji,5,"Rue Mouzdalifa, En Face De la Pastisserie Le Votre, Marrakech, Marrakech-Safi, Morocco"
964,Cafe 1913,5,"AV. Med. V. 42. Gueliz Marrakech, Marrakech, Marrakech-Safi, Morocco"
965,Falafel Rooftop House,5,"19 Derb El Hanch, Marrakech, Marrakech-Safi, Morocco"
966,Cafe De L'artist,5,"64 Trik Ben Saleh, Marrakesh 40030, Marrakech, Marrakech-Safi, Morocco"
967,Tajine Beldy,4.5,"Essaouira, Marrakech-Safi, Morocco"
968,Restaurant Chez Cidrek,4.5,"Rue Bani Marine N 41, Marrakech, Marrakech-Safi, Morocco"
969,Tilila Garden,4.5,"Km 47, Aghbalou, sitti Fadma, Ourika, Marrakech-Safi, Morocco"
970,Marrakech Bar,4.5,"Rua Jose Martins Caldeira 1, Palmela, Setubal District, Alentejo, Portugal"
971,DSTAGE,4.5,"Calle de Regueros, 8, Madrid, Spain"
972,El Fishawi,4,"Midan Hussein, Cairo, Cairo Governorate, Egypt"
973,Le Casablanca,4.5,"55 By Ward Market Sq, Ottawa, Ontario, Canada"
974,Darna Restaurante,5,"Calle Casapalma 11, Malaga, Costa del Sol, Province of Malaga, Andalucia, Spain"
975,Antouki,4.5,"Route de Taddert, Casablanca, Casablanca-Settat, Morocco"
976,Rockfeller Restaurant English Pub,4.5,"128 Boulevard D'anfa, Casablanca, Casablanca-Settat, Morocco"
977,Restaurant Du Maroc,4.5,"Comeniusstraat 513, Amsterdam, North Holland Province, The Netherlands"
978,Jacques,5,"30-32 Rue du Sentier, Paris, Ile-de-France, France"
979,Espace Olives,5,"Rue Ouarzazat Touama, Ait Ourir, Marrakech-Safi, Morocco"
980,Jamaal el Fna,5,"84 avenue du General Leclerc, Limoges, Haute-Vienne, Nouvelle-Aquitaine, France"
981,"Bar Restaurante Marrakech, Sevilla",5,"Calle de San Juan Bosco 55, Seville, Province of Seville, Andalucia, Spain"
982,Restaurant le Marrakech,4.5,"75 boulevard de la Tour D Auvergne, Rennes, Ille-et-Vilaine, Brittany, France"
983,L'Oasis de Marrakech,4.5,"1 rue des Coquelicots, Longjumeau, Essonne, Ile-de-France, France"
984,O Marrakech 95,4.5,"58 avenue de Paris, L'Isle-Adam, Val-d'Oise, Ile-de-France, France"
985,Marrakech Evolution,5,"Via Buccari 112, Bari, Province of Bari, Puglia, Italy"
986,Marrakech Gourmet,4.5,"64 rue d Anjou, Versailles, Yvelines, Ile-de-France, France"
987,Restaurant le marrakech(sasu el baraka),4.5,"19 rue de Vertpre, Nevers, Nievre, Bourgogne-Franche-Comte, France"
988,Panineria Kebab Marrakech,5,"Via Torino, Palermo, Province of Palermo, Sicily, Italy"
989,Restaurant Relais de Paris & Lounge Marrakech,5,"Zone de l'agdal, Boulevard Mohamed VI, Marrakech, Morocco, Marrakech, Marrakech-Safi, Morocco"
