,resto name,mark,location
586,Cafe Restaurant Maazouz,4,"192 - 194 Rue Rahba El Kedima, Marrakech, Marrakech-Safi, Morocco"
587,Restaurant les Terrasses,4,"202 Derb Bab Doukkala, Marrakech, Marrakech-Safi, Morocco"
588,Cafe Restaurant Al Jazeera,4,"Near Gare Routiere, Marrakech, Marrakech-Safi, Morocco"
589,La Pause Restaurant,4,"Douar Lmih Laroussiene, Marrakech, Marrakech-Safi, Morocco"
590,Witch Snack,4,"10 Bis Bd Lalla Fatima Zahra, Marrakech, Marrakech-Safi, Morocco"
591,Le Samovar,4,"Boulevard Moulay Rachid, Marrakech, Marrakech-Safi, Morocco"
592,Lola Sky Lounge,3,"Rue Oued El Makhazine, Angle Rue Imam Chafai, Marrakech, Marrakech-Safi, Morocco"
593,Riad des Mers,3.5,"411 derb SIDI messaoud, Marrakech, Marrakech-Safi, Morocco"
594,Bab Marrakesh,3.5,"Rue de Massa, Agadir, Souss-Massa, Morocco"
595,Sesame Garden,3,"Jamaa El Fna, Marrakech, Marrakech-Safi, Morocco"
596,Ristorante Luigi,3,"Gare ONCF, Marrakech, Marrakech-Safi, Morocco"
597,La Plage Rouge,3,"Route de l' Ourika, Marrakech, Marrakech-Safi, Morocco"
598,El Andalusiya,3.5,"Rue De La Kasbah, Marrakech, Marrakech-Safi, Morocco"
599,Le Comptoir Marrakech,4.5,"6 Place Saint Pierre, St-Chamond, Loire, Auvergne-Rhone-Alpes, France"
600,l' Escale de Marrakech,4.5,"49 B avenue du General Michel Bizot, Paris, Ile-de-France, France"
601,Tangier Cafe,4,"284 Main St, Great Barrington, Massachusetts"
602,News Cafe,4,"1Rue Abou Baker Seddiq L'hivernage, Marrakech, Marrakech-Safi, Morocco"
603,Nabab,3.5,"Avenue Mohammed VI, Marrakech, Marrakech-Safi, Morocco"
604,Le Marrakech,3.5,"Bahnhofplatz 6, Konstanz, Baden-Wurttemberg, Germany"
605,Casa Garcia Y Hijos,5,"Marrakech Plaza, Place du 16 Novembre, Marrakech, Marrakech-Safi, Morocco"
606,Ice Mama,5,"27 Galerie de la Liberte -Gueliz, Marrakech, Marrakech-Safi, Morocco"
607,Le Namaskar Restaurant,4.5,"Palais Namaskar, Marrakech, Marrakech-Safi, Morocco"
608,Chez rania,4.5,"26, Angle Tariq Ibn Ziad Et My Ali, Marrakech, Marrakech-Safi, Morocco"
609,Ikura Sushi,5,"Rue Oued Nafis Residence Hamza 1, Marrakech, Marrakech-Safi, Morocco"
610,Chez Bejgueni,4.5,"21 Rue Ibn Aicha, Marrakech, Marrakech-Safi, Morocco"
611,ZwenZwen Rooftop Restaurant,5,"10 Rue el Moustachfa, Marrakech, Marrakech-Safi, Morocco"
612,Safran By Koya,5,"Rue Jbel Lakhdar, Marrakech, Marrakech-Safi, Morocco"
613,Taberna12,4.5,"12 Rue Lobnane, Marrakech, Marrakech-Safi, Morocco"
614,Pizza Abdou,5,"Rue el Gza, Marrakech, Marrakech-Safi, Morocco"
615,Darbouka,5,"Rue De La Kasbah, Marrakech, Marrakech-Safi, Morocco"
616,The Pool Garden,4.5,"Route du Golf Royal, Marrakech, Marrakech-Safi, Morocco"
617,Al Fadl,4.5,"Rue El Imam Malik, Marrakech, Marrakech-Safi, Morocco"
618,Le Mouflon,4.5,"Rue Asni, Ouirgane, Marrakech-Safi, Morocco"
619,Stall 32,4.5,"Corner of food stalls jemaa el fnaa market, Marrakech, Marrakech-Safi, Morocco"
620,Pizzeria Niagara,4.5,"31-32 Cente COMMERCIAL Ennakhil route de Targa, Marrakech, Marrakech-Safi, Morocco"
621,SPICY - Asian Kitchen,4.5,"91 rue Mohamed el Beqal, Marrakech, Marrakech-Safi, Morocco"
622,AZZERA,4,"1 Boulevard de la Menara, Marrakech, Marrakech-Safi, Morocco"
623,C house marrakech,4,"9 Avenue Mohamed Vl et Avenue My Hassan, Marrakech, Marrakech-Safi, Morocco"
624,Le Kesh,4.5,"180 Cowley Road, Oxford, Oxfordshire, England, United Kingdom"
625,KARMA Cafe Marrakech,4,"11 Avenue Mohammed VI, Marrakech, Marrakech-Safi, Morocco"
626,Le basilic restaurant des reves,5,"Km 27 Depuis Boumalne Dades, Boumalne Dades, Souss-Massa, Morocco"
627,Berber Food Restaurant,5,"Ksar mellab, Errachidia, Meknes-Tafilalet Region, Morocco"
628,Il Mago Merlino,4.5,"Via dei Pilastri 31r, Florence, Tuscany, Italy"
629,Ryad Alya,5,"8 bis Derb EL Guebbass, Fes, Fes-Meknes, Morocco"
630,Rim Atlas,4.5,"79, Hay Darkoum Avenue hassan II, Beni Mellal, Beni Mellal-Khenifra, Morocco"
631,Le Zinc,4.5,"Route de Safi, Marrakech, Marrakech-Safi, Morocco"
632,The Patio at Dar Hanane,5,"9 Derb Lalla Azzouna, Marrakech, Marrakech-Safi, Morocco"
633,alma,5,"Angle Rue Allal Ben Ahmed, Marrakech, Marrakech-Safi, Morocco"
634,Kesh Cup,5,"Route Sidi Abdelaziz 29, Marrakech, Marrakech-Safi, Morocco"
635,Le Marrakech,4,"19 rue Castellane, Toulouse, Haute-Garonne, Occitanie, France"
636,La Casita Mexicana,5,"Calle Moncayo 12, Fuengirola, Costa del Sol, Province of Malaga, Andalucia, Spain"
637,RIAD MARRAKECH,4.5,"167 av de la Liberation C de Gaulle, Le Bouscat, Bordeaux, Gironde, Nouvelle-Aquitaine, France"
638,Les Jardins de Marrakech,4.5,"Place de la Liberation, Privas, Ardeche, Auvergne-Rhone-Alpes, France"
639,C House Coffee Shop,4,"Avenue Mohammed VI, Marrakech, Marrakech-Safi, Morocco"
640,Plats Haj Boujemaa,4,"65 Rue Mohamed El Bakkal, Marrakech, Marrakech-Safi, Morocco"
641,Le Souk,4,"98 quai du Port, Marseille, Bouches-du-Rhone, Provence-Alpes-Cote d'Azur, France"
642,Fuddruckers Marrakech,3,"Avenue Abdelkrim Khettabi, Marrakech, Marrakech-Safi, Morocco"
643,Pizzeria Venezia,3,"279 Avenue Mohammed VI, Marrakech, Marrakech-Safi, Morocco"
644,Victor Paris,3.5,"Avenue Mohammed VI, Marrakech, Marrakech-Safi, Morocco"
645,La Medina,3.5,"13 Derb El Hammam - Guerniz, Fes, Fes-Meknes, Morocco"
646,Mandaloun Restaurant Libanais,2.5,"Marrakech Rue Mohammed - Residence Meriem-4000, Marrakech, Marrakech-Safi, Morocco"
647,La Poele Marrakech,4.5,"Lot 17, Residence A Immeuble 1, Magasin N_1, Marrakech, Marrakech-Safi, Morocco"
648,SABICH MARRAKECH,5,"110 Rue Fatima Zahra, Dar El Bacha, Marrakech, Marrakech-Safi, Morocco"
649,BestBurger Marrakech,5,"10 St Sourya, Marrakech, Marrakech-Safi, Morocco"
650,Hotel restaurant azilal,5,"Ourika sitti fatima, Ourika, Marrakech-Safi, Morocco"
651,Ksar Char-Bagh,4.5,"Palmeraie de Marrakech, Marrakech, Marrakech-Safi, Morocco"
652,Gusto,4.5,"Bd Mohamed VI, Marrakech, Marrakech-Safi, Morocco"
653,Pasta Cosy,4.5,"Circuit de la Palmeraie, Marrakech, Marrakech-Safi, Morocco"
654,Casa Mounia,4.5,"3 Rue Laalouj, Essaouira, Marrakech-Safi, Morocco"
655,Le Marrakech,4,"20 boulevard de Strasbourg, Nogent-sur-Marne, Val-de-Marne, Ile-de-France, France"
656,1000 & 1 Signes,5,"76 rue de Charonne, Paris, Ile-de-France, France"
657,Ksar Merzouga,4.5,"Hassi labiad Merzouga, Merzouga, Draa-Tafilalet, Morocco"
658,Kasbah Tafarnout,4.5,"Number 74 Av Mohammed V, Ouarzazate, Draa-Tafilalet, Morocco"
659,Auberge Azaddou Tamlalt,4.5,"Ait Ben Haddou Amerzegan Ouarzazate, Ait Ben Haddou, Souss-Massa, Morocco"
660,La Pergola,4.5,"19 Boulevard Moulay Rachid, Casablanca, Casablanca-Settat, Morocco"
661,Restaurant Omazonia,4.5,"Angle Avenue Echouhada, rue de paris, quartier de l'Hivernage, Marrakech, Marrakech-Safi, Morocco"
662,La Rose Des Sables Restaurant Pizzeria,4.5,"km 1 Route de Zagora N9 Tabounte CR Tarmigte, Ouarzazate, Draa-Tafilalet, Morocco"
663,Ocha Sushi,4,"43 Rue Yugoslavie, Gueliz, Marrakech, Marrakech-Safi, Morocco"
664,Dar Passtilla,4,"Rue des Banques, Marrakech, Marrakech-Safi, Morocco"
665,La Lune d'Or Restaurant,4,"Circuit de la Palmeraie, Marrakech, Marrakech-Safi, Morocco"
666,Cafe Bousafsaf,4,"Rue Yves Saint Laurent, Marrakech, Marrakech-Safi, Morocco"
667,Moncho's House,4,"Rue Imam Chafai, Marrakech, Marrakech-Safi, Morocco"
668,Chez Achraf Cafe Ben Youssef,4,"20 Av. El Hanaa M, Marrakech, Marrakech-Safi, Morocco"
669,Hivernage Hotel & Spa,4,"Angle Ave Echouhada et Rue des Temples, Marrakech, Marrakech-Safi, Morocco"
670,Snack Les Visiteur De La Koutoubia,4,"Rue Fatima Zouhra Rmila 7, Marrakech, Marrakech-Safi, Morocco"
671,La Cantina,4,"La Palmeraie, Marrakech, Marrakech-Safi, Morocco"
672,La Porte du Marrakesh,4,"Rue Riad Zitoune Jdid, Marrakech, Marrakech-Safi, Morocco"
673,Mogador Fish,4,"Rue Ben Marin Imm. Mallali, Marrakech, Marrakech-Safi, Morocco"
674,Oriental Legend,4,"52, Rue Bab Agnaou, Marrakech, Marrakech-Safi, Morocco"
675,Restaurant Fayrouz,4,"12 Boulevard Abdelkrim Al Khattabi, Marrakech, Marrakech-Safi, Morocco"
676,Restaurant Al Khayma,5,"Passage Prince Moulay Rachid, Marrakech, Marrakech-Safi, Morocco"
677,Restaurant Riad Omar,3,"22, Rue Bab Agnaou, Marrakech-Safi, Morocco"
678,Al Ahbab Fast Food,3.5,"70 Rue de Bab Agnaou, Marrakech, Marrakech-Safi, Morocco"
679,La bonne adresse,3.5,"Rue Yves Saint Laurent, Marrakech, Marrakech-Safi, Morocco"
680,Baba Turc,3.5,"2 Avenue De La Menara, Marrakech, Marrakech-Safi, Morocco"
681,Almasraf Restaurant - Cafe,3.5,"23 Rte Dar Daou, Marrakech, Marrakech-Safi, Morocco"
682,Vamos,3.5,"Zone de l'Agdal, bv Mohamed 6, Marrakech, Marrakech-Safi, Morocco"
683,Restaurant Bab Sbaa,3.5,"Place de la Rochelle, Complexe Commercial Bin Al Aswar, Essaouira, Marrakech-Safi, Morocco"
684,Argane Tichka Restaurant,3.5,"Douar Amsitane, Amadsiydal, Marrakech-Safi, Morocco"
685,Le Maitre De Viande,3.5,"Rue Ibn Toumert, Marrakech, Marrakech-Safi, Morocco"
686,Snack Adam,5,"197 Hotel De France , Riad Zitoune Lakdim, Marrakech, Marrakech-Safi, Morocco"
687,Le Marocain,4,"47 rue des Couteliers, Toulouse, Haute-Garonne, Occitanie, France"
688,Katopazzo & die Totem Bar,4,"Amalienstr. 87, Munich, Upper Bavaria, Bavaria, Germany"
689,Tacos de Lyon (Bourgogne),4,"Rue de Goulmima, Casablanca, Casablanca-Settat, Morocco"
690,Le Mecano,4,"194 Rue Mohamed El Bakkal, Marrakech, Marrakech-Safi, Morocco"
691,Touroug Cafe,2.5,"Ksar Touroug, Errachidia, Meknes-Tafilalet Region, Morocco"
692,Hotel Ouzoud,3,"Route de Marrakech, Km. 3, Beni Mellal, Beni Mellal-Khenifra, Morocco"
693,Starbucks,3,"Boulevard De L'Ocean Atlantique, Casablanca, Casablanca-Settat, Morocco"
694,Teteria Cordoba,3.5,"Calle Buen Pastor 19, Cordoba, Province of Cordoba, Andalucia, Spain"
695,Milagros Restaurant,3.5,"West Palmarie, Marrakech, Marrakech-Safi, Morocco"
696,Casa de Hoy,5,"N. 12 Rue Abou Bakr Seddiq, Marrakech, Marrakech-Safi, Morocco"
697,Amasia,5,"11 Derb Nousrial, Marrakech, Marrakech-Safi, Morocco"
698,Ecriture,4,"80 Queen's Road Central, Hong Kong, China"
699,Nouba,3.5,"Zone Touristique de l_Agdal, Boulevard Mohamed 6, Marrakech, Marrakech-Safi, Morocco"
700,Cafe de France,3,"Piazza Mulay Hassan, Essaouira, Marrakech-Safi, Morocco"
701,El Khaima,3,"Rue Laalouj, Essaouira, Marrakech-Safi, Morocco"
702,Brunch & Co,3.5,"Avenue Sidi Mohamed Ben Abdellah, Essaouira, Marrakech-Safi, Morocco"
703,Delices et Saveurs,4.5,"Rue Boutouil, Essaouira, Marrakech-Safi, Morocco"
704,Red Marrakech,4,"Via Santa Chiara 7, Naples, Province of Naples, Campania, Italy"
705,Cafe Restaurant Central,4.5,"Av Hassan 11, Tinerhir, Souss-Massa, Morocco"
706,Broadway Dive,4,"2662 Broadway, New York City, New York"
707,Malebon Cafe,4,"21 Kingsbury, Aylesbury, Aylesbury Vale, Buckinghamshire, England, United Kingdom"
708,Sahara City,4,"Route de La Foret, St Martin, Guernsey, Channel Islands, United Kingdom"
709,Restaurant al Fassia,3,"21 Rue Salaj, Fes, Fes-Meknes, Morocco"
710,Kasbah Valentine Restaurant,4.5,"Ait Ben Haddou, Souss-Massa, Morocco"
711,Scorpion House,4.5,"Scorpion House 54 Drouj El Hafa, Moulay Idriss, Meknes-Tafilalet Region, Morocco"
712,La Petite Perle,4,"Entre la Place de l'Horloge et La Casbah, Essaouira, Marrakech-Safi, Morocco"
713,La Kasbah,4,"Rue Antoine Dansaert 20, Brussels, Belgium"
714,Bab Marrakech,4,"Route casa km 15 adroite vers Marrakech, Marrakech, Marrakech-Safi, Morocco"
715,Tangia,4,"Wyndham Grand Hotel, Doha, Qatar"
716,Meimo,4.5,"69/70 Peascod Street, Windsor, Windsor and Maidenhead, Berkshire, England, United Kingdom"
717,le jardin majorelle,4.5,"Rue des Puits l'Eau 33, Tournai, Hainaut Province, Wallonia, Belgium"
718,Essaouira,4,"16 rue de Magdebourg, Paris, Ile-de-France, France"
719,Taberna Mogador,4,"Calle Bernabe Fernandez 24, Torre del Mar, Costa del Sol, Province of Malaga, Andalucia, Spain"
720,The Larder Bethnal Green,3.5,"241-243 Globe Road, London, England, United Kingdom"
721,Falafel Plus Arabia,4.5,"Rue Rhal Ben Ahmed, Marrakech, Marrakech-Safi, Morocco"
722,Restaurant Cacher Wasabi,4.5,"17, Rue De Yougoslavie, Marrakech, Marrakech-Safi, Morocco"
723,Patisserie Belkabir Medina,5,"Souk Semmarine N11, Marrakech, Marrakech-Safi, Morocco"
724,Les Trois Saveurs,4.5,"1, Derb Sahb, Bab Doukkala, Marrakech, Marrakech-Safi, Morocco"
725,Restaurant Koutoubia Royal,5,"number 87 BD Rmila. Rue Fatima Zahra, Marrakech, Marrakech-Safi, Morocco"
726,Cafe 113,5,"15 Rue Lobnane, Marrakech, Marrakech-Safi, Morocco"
727,Casablanca Moroccan Kitchens,5,"6919 Melrose Ave, Los Angeles, California"
728,Moggo,5,"Oasis 2, Rue Imam Majja, Marrakech, Marrakech-Safi, Morocco"
729,Hatari Restaurant,4.5,"Route de Targa, Av. de la 4eme DMM, Marrakech, Marrakech-Safi, Morocco"
730,Restaurant Goytisolo,5,"89 Passage Prince Moulay Rachid, Marrakech, Marrakech-Safi, Morocco"
731,Mango Zen Pool & Restaurant,4.5,"Route de fes, Marrakech, Marrakech-Safi, Morocco"
732,Restaurant Imilale,4.5,"47 Rue Mohamed El Bakkal, Marrakech, Marrakech-Safi, Morocco"
733,Dar Tadout,5,"Ait Ourir Hay Ait Lcadi, Ait Ourir, Marrakech-Safi, Morocco"
734,Bidaya Sunset Bar by Almaha,5,"55 derb ben zina la kasbah, Marrakech, Marrakech-Safi, Morocco"
735,Tizi Ait Barka,4.5,"N9, Marrakech-Safi, Morocco"
736,Cafe Kech Wink,5,"Roux Batiment 1 Houmane el Fetouaki, Marrakech, Marrakech-Safi, Morocco"
737,Arancino,4.5,"Four Seasons Resort Marrakech, Marrakech, Marrakech-Safi, Morocco"
738,L'Orangerie,5,"Rue Harroun Errachid, Marrakech, Marrakech-Safi, Morocco"
739,Grill Bar Restaurant Casher,4.5,"Av. du President Kennedy, Marrakech, Marrakech-Safi, Morocco"
740,L'italiano,5,"Av. Du Colonel Gazeille, Marrakech, Marrakech-Safi, Morocco"
741,Le Rolls -s Restaurant Bar,4.5,"6, Angle Draa, Marrakech, Marrakech-Safi, Morocco"
742,La Broche,4.5,"232 Boulevards Mohamed V, Marrakech, Marrakech-Safi, Morocco"
743,La Grande Table Marocaine,4,"Rue Abou Abbas El Sebti, Marrakech, Marrakech-Safi, Morocco"
744,Taj Medina,5,"N _ 4 Rue Riad Laarouss, Marrakech, Marrakech-Safi, Morocco"
745,Al Ain,4.5,"BP 2470 Km 12 route d'Amizmiz, Marrakech, Marrakech-Safi, Morocco"
746,Starbucks,4.5,"2690 Broadway, New York City, New York"
747,Casablanca Restaurant,4.5,"3516 Fair Oaks Blvd, Sacramento, California"
748,Cafe Atlas,4.5,"23 -27 Glass Arcade, Bristol, England, United Kingdom"
749,Snack Derb Dabachi,5,"Rue Kennaria 31, Marrakech, Marrakech-Safi, Morocco"
750,Beach Mama Marrakech,4.5,"Les Jardins De L'atlas Km 13 Route De L'ourika, Marrakech, Marrakech-Safi, Morocco"
751,Cannery Restaurant,4.5,"48 John St, Niagara-on-the-Lake, Ontario, Canada"
752,Flor da Laranja,4.5,"R. da Rosa, Lisbon, Lisbon District, Central Portugal, Portugal"
753,Azou,4.5,"375 King Street, London, England, United Kingdom"
754,Le Cuisto Traditionnel,4.5,"Angle Abderrahmane Sahraoui et Houssine ben Ali,N_3-City Park, Casablanca, Casablanca-Settat, Morocco"
755,Le Marrakech,4,"28 avenue Edouard Herriot, Brive-la-Gaillarde, Correze, Nouvelle-Aquitaine, France"
756,Broadway Bagel,4.5,"2658 Broadway, New York City, New York"
757,Cafe Clock Chefchaouen,4.5,"3 Derb Tijani, Chefchaouen, Tanger-Tetouan-Al Hoceima, Morocco"
758,Al-Medina,4.5,"Calle San Roque 13, Seville, Province of Seville, Andalucia, Spain"
759,Il-Baxa Cafe Bar,4.5,"41 Triq Il-Kbira, Rabat, Island of Malta, Malta"
760,Restaurante Arabel Halal  Marrakech,4.5,"Carrer de Bejar, 87, Barcelona, Catalonia, Spain"
761,Le Marrakech,4.5,"6 rue Leonard Limosin, Limoges, Haute-Vienne, Nouvelle-Aquitaine, France"
762,Le Marrakech,4.5,"13 bd Louis Franchet D Esperey, Lorient, Morbihan, Brittany, France"
763,Restaurante Marrakech,4.5,"Calle Cordonerias 3, Toledo, Province of Toledo, Castile-La Mancha, Spain"
764,La Porte du Marrakech,4.5,"Toualet Kennaria No 78, Marrakech, Marrakech-Safi, Morocco"
765,Royal Golf Marrakech -Restaurant,4,"Route du Golf Royal, Marrakech, Marrakech-Safi, Morocco"
766,Cafe Marrakech,3,"Rue de la Skala, Essaouira, Marrakech-Safi, Morocco"
767,Restaurante Marrakesh,4.5,"Avenida Conde de Valbom 53, Lisbon, Lisbon District, Central Portugal, Portugal"
768,Taberna da Esperanca,4.5,"Rua da Esperanca 112, Lisbon, Lisbon District, Central Portugal, Portugal"
769,Restaurant Lounge MB,4.5,"12 Rue Ahmed Chaouki, Fes, Fes-Meknes, Morocco"
770,Isabelle's,4.5,"2937 Beach Blvd S, Gulfport, Florida"
771,Blue Toque Diner,4.5,"601 1st Avenue, Fernie, Kootenay Rockies, British Columbia, Canada"
772,Basmane,4,"Angle boulevard de l'ocean atlantique et boulevard de la corniche ain diab, Casablanca, Casablanca-Settat, Morocco"
773,Ecco Pizzeria,4,"93 Otley Road, Leeds, West Yorkshire, England, United Kingdom"
774,Jasper's Corner Tap & Kitchen,4,"401 Taylor St, San Francisco, California"
775,Le  Marrakech,4,"60 rue de Strasbourg, Chalon-sur-Saone, Saone-et-Loire, Bourgogne-Franche-Comte, France"
776,La Tour de Marrakech,4,"72 avenue de la Division Leclerc, Antony, Hauts-de-Seine, Ile-de-France, France"
777,Malaika Riad & Table D’Hotes,5,"Derb Zayan No 17, Essaouira, Marrakech-Safi, Morocco"
778,Restaurant Des Reves Essaouira,4.5,"2 Avenue Sidi Mohmed Ben Abdallah, Essaouira, Marrakech-Safi, Morocco"
779,Ice Rolls Marrakech,4.5,"6 Avenue Mohammed VI, Marrakech, Marrakech-Safi, Morocco"
780,Restaurant Populaire Marrakech,4.5,"Rue Bani Marine, Marrakech, Marrakech-Safi, Morocco"
781,Cafe Lounge Marrakesh,4,"Budecska 1005/12, Prague, Bohemia, Czech Republic"
782,YAFO Kitchen,4.5,"720 Governor Morrison St, Charlotte, North Carolina"
783,Al Farid,5,"26 Holywell Hill, St. Albans, Hertfordshire, England, United Kingdom"
784,Vert Midi,3.5,"234 Avenue Mohammed VI, Marrakech, Marrakech-Safi, Morocco"
785,Shokran,4.5,"4027 W Irving Park Rd, Chicago, Illinois"
786,Hanna's Gourmet,4.5,"2864 Adams Ave, San Diego, California"
787,Teteria Palacio Nazari,3.5,"Calle San Agustin, Malaga, Costa del Sol, Province of Malaga, Andalucia, Spain"
788,Chez Hicham,5,"84 Boulevard Mohamed, Marrakech, Marrakech-Safi, Morocco"
789,La Table d'Antoine - Le Social Club,5,"Rue Oued El makhazine, Marrakech, Marrakech-Safi, Morocco"
790,Le Palais Imperial,4.5,"Mail Saint Martin, Cambrai, Nord, Hauts-de-France, France"
791,Patisserie Corne De Gazelle Chez Brahim,5,"N_ 137 Rue Riad Zitoun El Jdid, Marrakech, Marrakech-Safi, Morocco"
792,Casablanca,4.5,"D L F Golf Course Road, Gurugram (Gurgaon), Gurgaon District, Haryana, India"
793,Bethsabee,5,"Arsat Maach, 91 Avenue Hommane Fetouak, Marrakech, Marrakech-Safi, Morocco"
794,Riad Princesse Du Desert,5,"N67 Derb Habib Allah, Marrakech, Marrakech-Safi, Morocco"
795,Moroccan Food & More,4.5,"39 Rue Mohamed El Bakkal, Marrakech, Marrakech-Safi, Morocco"
796,The good bun,4.5,"7 avenue Mohamed 6, Sergent levet, Marrakech, Marrakech-Safi, Morocco"
797,Airlines Hotel Restaurant,3.5,"4 Madras Bank Road, Bengaluru, Bangalore District, Karnataka, India"
798,Chez Mounir,4.5,"Centre Cascades d'Ouzoud, Ouzoud, Beni Mellal-Khenifra, Morocco"
799,Bocaito Andalusi Halal,4.5,"Paseo de la Victoria, Cordoba, Province of Cordoba, Andalucia, Spain"
800,Nomad Restaurant,4,"78 2nd Avenue, New York City, New York"
801,L'Etoile Centrale,4,"107 rue Allal ben Abdellah, Casablanca, Casablanca-Settat, Morocco"
802,Shore Club Hotel,4,"1901 Collins Ave, Miami, Florida"
803,Le Relais des Artistes,4,"N_94 - Derb Boutouil, Marrakech, Marrakech-Safi, Morocco"
804,Bacha Coffee,4,"#01-15/16, Singapore, Singapore"
805,Sandflames Gourmet Grill,3.5,"Victoria Road, London, England, United Kingdom"
806,D Bodega,3.5,"Blvd Mohammed VI, Marrakech, Marrakech-Safi, Morocco"
807,Cafe Restaurant Tagudalt,3,"N9, Ouarzazate, Draa-Tafilalet, Morocco"
808,The Cat Lounge,3.5,"Avenue Mohammed VI, Marrakech, Marrakech-Safi, Morocco"
809,McDonald's McDrive,3.5,"Route de Casablanca, Marrakech, Marrakech-Safi, Morocco"
810,Salad8ox,3.5,"Hivernage, Marrakech, Marrakech-Safi, Morocco"
811,Stork,4,"Rue de La Kasbah, Marrakech, Marrakech-Safi, Morocco"
812,Restaurant Hotel Chez Juju,4,"Station de ski Oukaimeden, Oukaimeden, Marrakech-Safi, Morocco"
813,La Kasbah de l'Ourika,4,"Rte de l'Ourika , KM 45, Marrakech, Marrakech-Safi, Morocco"
814,Restaurant Assala,4,"2 Chrabliyenne Rue Talaa Kebira Fes Medina, Fes, Fes-Meknes, Morocco"
815,Le Coin des Artistes,4,"32 Rue Isisco Boujloud, Fes, Fes-Meknes, Morocco"
816,Hadiqa,4,"40 Irwin St, Perth, Greater Perth, Western Australia, Australia"
817,La Table Du Marche Gourmet Market Carre Eden,3.5,"Avenue Mohammed V, Marrakech, Marrakech-Safi, Morocco"
818,Le Bar Majorelle,3,"Avenue Bab Jdid, Marrakech, Marrakech-Safi, Morocco"
819,Yassalam Restaurant,3.5,"N9 Rue des Banques, Marrakech, Marrakech-Safi, Morocco"
820,La Villa Blanche,4,"Baie des Palmiers secteur No50 cite Founty, Agadir, Souss-Massa, Morocco"
821,Wanha Hullu Poro,4,"Rakkavaarantie 5, Levi, Lapland, Finland"
822,Chez Said,4,"Bab Boujloud, Fes, Fes-Meknes, Morocco"
823,Dar el Bacha Coffee Room & Boutique,5,"Route Sidi, Marrakech, Marrakech-Safi, Morocco"
824,Riad Lotus Privilege,5,"245 Avenue Med V, Marrakech, Marrakech-Safi, Morocco"
825,MOBB House,5,"Magazin Numero 3 Centre D Affair Anas Route De Tar, Marrakech, Marrakech-Safi, Morocco"
826,Le Coq Hardi,5,"Pond Ouad Zat, Ouarzazate, Draa-Tafilalet, Morocco"
827,The Cellar Kitchen,3.5,"42 Pioneer Ave, Rowland Flat, Barossa Valley, South Australia, Australia"
828,Six By Nico,3.5,"1 Molesworth Pl, Dublin 2, Dublin, County Dublin, Ireland"
829,Hotel Restaurant Imperial Peace la Paix,3,"Avenue de la Marche Verte Hay Riad, Ifrane, Fes-Meknes, Morocco"
830,Ecco Pizza,3.5,"90 Street Lane, Leeds, West Yorkshire, England, United Kingdom"
831,Sandro Kortteli,3,"Urho Kekkosen Katu 1, Helsinki, Uusimaa, Finland"
832,La Perle Patisserie,3.5,"39-41 Wicker, Sheffield, South Yorkshire, England, United Kingdom"
833,Cafe Paprika,4.5,"734 Washington St, Norwood, Massachusetts"
834,Schumann's Bar,3.5,"Odeonsplatz 6+7, Munich, Upper Bavaria, Bavaria, Germany"
835,The Peacock Inn Chelsworth,4.5,"37 The Street, Chelsworth, Babergh District, Suffolk, East Anglia, England, United Kingdom"
836,Restaurant Gout de Meknes,4.5,"N_ 2 Rue Kerstoune en face de la grande mosquee, Meknes, Fes-Meknes, Morocco"
837,Teteria Almedina,4.5,"Calle Paz 2, Almeria, Province of Almeria, Andalucia, Spain"
838,La Pigeot,4,"16 rue Alexis Julien, Valbonne, French Riviera - Cote d'Azur, Provence-Alpes-Cote d'Azur, France"
839,Restaurant Chez Dimitri,4,"22 Avenue Mohamed V, Ouarzazate, Draa-Tafilalet, Morocco"
840,Bab Dar Moroccan Kitchen,4,"Chaussee de Charleroi 85, Brussels, Belgium"
841,Muchaxo,3,"Estrada do Guincho, Cascais, Lisbon District, Central Portugal, Portugal"
842,Cactus cafe Marrakech,5,"Avenue Abdelkrim Khettabi, Marrakech, Marrakech-Safi, Morocco"
843,The Dining Room at L'Hotel Marrakech,5,"41 Derb Sidi Lahcen ou Ali, Marrakech, Marrakech-Safi, Morocco"
844,Marrakech Restaurang,4.5,"Valhallavagen 193, Stockholm, Sweden"
845,Marrakech Restaurant,4.5,"5 Bangui Street, Abuja, Federal Capital Territory, Nigeria"
846,Marrakech,4.5,"26 rue Marie Davy, Clamecy, Nievre, Bourgogne-Franche-Comte, France"
847,Le Marrakech,4.5,"111 rue de Paris, Valenciennes, Nord, Hauts-de-France, France"
848,Marrakesch Aragana,4.5,"Olgastrasse 91, Ulm, Baden-Wurttemberg, Germany"
849,Cafe & Resto Marrakech,4.5,"Cap Marina, Monastir, Monastir Governorate, Tunisia"
850,Yoka Sushi,4,"232 boulevard Mohamed 5, Marrakech, Marrakech-Safi, Morocco"
851,Art i pa andorra,4,"Bonaventura ribaraguaya, Andorra la Vella, Andorra la Vella Parish, Andorra"
852,Cafe Chez Sarghini,4,"Rue Azbezt, Marrakech, Marrakech-Safi, Morocco"
853,Koutoubia,4,"2116 Westwood Blvd, Los Angeles, California"
854,Venezia Ice,3,"Rue Zahla, Rabat, Rabat-Sale-Kenitra, Morocco"
855,Zaman Food,4,"N 80 Rue Fatima Ezzaha Baby Doukkala, Marrakech, Marrakech-Safi, Morocco"
856,Terrasse La Cigogne,3.5,"112 Riad Zitoun Lakdim, Marrakech 40000 15 M, Marrakech, Marrakech-Safi, Morocco"
857,Sandro Ratina,4,"Vuolteenkatu 5, Tampere, Pirkanmaa, Finland"
858,Le Printemps,4,"Boulevard El Mansour Eddahbi, Angle Rue El Beqal, Marrakech, Marrakech-Safi, Morocco"
859,Boston Coffee Restaurant,4,"Bd Allal Al Fassi, Marrakech, Marrakech-Safi, Morocco"
860,Kasar el Hamra,4,"28 Sabt Ben Daoud, Marrakech, Marrakech-Safi, Morocco"
861,Restaurant Atlas,4,"rue Chaponniere 16, Geneva, Switzerland"
862,Juice Bar,4,"Avenue Yacoub El Mansour, Marrakech, Marrakech-Safi, Morocco"
863,British Airways Lounge,3.5,"Perimeter Road East, Crawley, West Sussex, England, United Kingdom"
864,The a la menthe,4,"Faelledvej 14, Copenhagen, Zealand, Denmark"
865,HSandCo,3.5,"405 High Street, London, England, United Kingdom"
866,Dolce Freddo,4,"Place Hassan II, Essaouira, Marrakech-Safi, Morocco"
867,GB Roof Garden,4.5,"1 Vasileos Georgiou A_ Str., Athens, Attica, Greece"
868,Cafe Marrakech,1.5,"Chardin St., 15, Tbilisi, Georgia"
869,Bab Marrakech,5,"Evthanoforos 10, Athens, Attica, Greece"
870,Le Marrakech,4.5,"Boulevard Paul Martin Nalin, Manosque, Alpes-de-Haute-Provence, Provence-Alpes-Cote d'Azur, France"
871,Eat Thai Marrakech,4.5,"Angle Mohamed 5 et Rue El Mouatamid Ben Abbad, Marrakech, Marrakech-Safi, Morocco"
872,Croque & craque - Marrakech,5,"19 Rue de L'academie, Marrakech, Marrakech-Safi, Morocco"
873,Little Mamma Marrakech,3.5,"55 Boulevard Zerktouki Gueliz, Marrakech, Marrakech, Marrakech-Safi, Morocco"
874,Le Palais  de Marrakech,4.5,"7 Place de l'Hotel de ville, Chateau-Thierry, Aisne, Hauts-de-France, France"
875,Restaurant Marrakech,4.5,"28 boulevard des Allies, Calais, Pas-de-Calais, Hauts-de-France, France"
876,Tajine Marrakech,4.5,"Grafenstr. 37, Darmstadt, Hesse, Germany"
877,Cafe Restaurant Nesto Marrakech,5,"Boulevard Yacoub Marini, Marrakech, Marrakech-Safi, Morocco"
878,Marrakech Palmeraie,4.5,"107 Rue Georges Lenotre, Rambouillet, Yvelines, Ile-de-France, France"
879,Bor'kan Marrakech,5,"4 Rue Rhal Ben Ahmed, Marrakech, Marrakech-Safi, Morocco"
880,Marrakech Tarragona,5,"Plaza Sedassos , 5 - Cp 43007, Tarragona, Costa Dorada, Province of Tarragona, Catalonia, Spain"
