,resto name,mark,location
0,Comptoir Darna Marrakech,4.5,"Avenue Echouhada, Marrakech, Marrakech-Safi, Morocco"
1,Pepe Nero,4.5,"17 Derb Cherkaoui, Marrakech, Marrakech-Safi, Morocco"
2,Dar Zellij,4.5,"No1 Kaa Sour, Sidi Ben Slimane, Marrakech, Marrakech-Safi, Morocco"
3,Bazaar Cafe,4.5,"Derb Sidi El Yamani, 24B, Marrakech, Marrakech-Safi, Morocco"
4,Azar,4.5,"Rue de Yougoslavie, Marrakech, Marrakech-Safi, Morocco"
5,Gastro MK at Maison MK,4.5,"14 Derb Lafkih Sbaai, Marrakech, Marrakech-Safi, Morocco"
6,Medina Burger,5,"91 Avenue Homman Fetouaki, Marrakech, Marrakech-Safi, Morocco"
7,Little Marrakech,4.5,"31 Market Place, St. Albans, Hertfordshire, England, United Kingdom"
8,Dar Cherifa,4.5,"8 derb Cherfa Lakbir, Moussine, Marrakech, Marrakech-Safi, Morocco"
9,Naranj,4.5,"84 Rue Riad Zitoun Jdid, Marrakech, Marrakech-Safi, Morocco"
10,NOMAD,4,"1, Derb Aajrane, Marrakech, Marrakech-Safi, Morocco"
11,Terrasse des Epices,4,"15 Souk Charifia Sidi Abdellaziz, Marrakech, Marrakech-Safi, Morocco"
12,Le Grand Cafe De La Poste,4,"Angle Boulevard El Mansour Eddahbi Et Avenue Imam, Marrakech, Marrakech-Safi, Morocco"
13,Kosy Bar,4,"Place des Ferblantiers, Marrakech, Marrakech-Safi, Morocco"
14,Restaurant of La Maison Arabe,4.5,"1 Derb Assehbe, Marrakech, Marrakech-Safi, Morocco"
15,Le Salama Sky Bar,3.5,"40 Rue de Banques, Marrakech, Marrakech-Safi, Morocco"
16,Al Fassia Aguedal Restaurant,4,"55 Boulevard Zerktouni, Marrakech, Marrakech-Safi, Morocco"
17,Roti D'or,4.5,"Taoualat Ben Saleh 64, Marrakech, Marrakech-Safi, Morocco"
18,Le Foundouk,4,"55, Souk Hal Fassi, Marrakech, Marrakech-Safi, Morocco"
19,Kui-Zin Medina,4.5,"12, Rue Amsefah, Sidi Abdelaziz .Medina, Marrakech, Marrakech-Safi, Morocco"
20,Le Jardin,4,"32 Souk Sidi Abdelaziz, Marrakech, Marrakech-Safi, Morocco"
21,Marrakech Avenue,4,"58 Princes Avenue, Kingston-upon-Hull, East Riding of Yorkshire, England, United Kingdom"
22,Zwin Zwin Cafe,4.5,"10 Rue El Moustachfa, Riad Mokha, Marrakech, Marrakech-Safi, Morocco"
23,Earth Cafe Marrakech,4,"Riad Zitoun Lakdim, Marrakech, Marrakech-Safi, Morocco"
24,Zeitoun Cafe Jemaa El Fnaa,4.5,"107 Place Jemaa El Fnaa, Marrakech, Marrakech-Safi, Morocco"
25,Marrakech Restaurant,4.5,"91 O'Connell St, Adelaide, Greater Adelaide, South Australia, Australia"
26,Limoni Cafe and Restaurant,4.5,"40, Dyour Saboun, Marrakech, Marrakech-Safi, Morocco"
27,Un Dejeuner a Marrakech,4.5,"2-4 Angle Douar Graoua-Kennaria, Marrakech, Marrakech-Safi, Morocco"
28,Cafe Arabe,4,"184, rue Mouassine, Marrakech, Marrakech-Safi, Morocco"
29,Restaurant Red House,4.5,"Avenue el yarmouk and rue Abdelaziz Elmalzouzi, Marrakech, Marrakech-Safi, Morocco"
30,Marrakech Henna Art Cafe,4.5,"35 Derb Sqaya, Marrakech, Marrakech-Safi, Morocco"
31,Marrakech Restaurant,4.5,"1122 Stratford Road, Birmingham, West Midlands, England, United Kingdom"
32,La Table Du Riad at 72 Riad Living,4.5,"72 Arset Awzel, Bab Doukkala, Marrakech, Marrakech-Safi, Morocco"
33,BlackChich Cafe Restaurant,4.5,"1 Derb Nakouss Riad Zitoune El Jedid, Marrakech, Marrakech-Safi, Morocco"
34,Cafe Clock,4.5,"224 Derb Chtouka, Marrakech, Marrakech-Safi, Morocco"
35,Amal,4.5,"Rue Allal Ben Ahmed et Rue Ibn Sina, Marrakech, Marrakech-Safi, Morocco"
36,La Pergola,4.5,"7/8 Derb Chaabane - Riad Zitoun Lkd, Marrakech, Marrakech-Safi, Morocco"
37,Pointbar,5,"3 bis rue Abou Hayane Taouhidi, Gueliz, Marrakech, Marrakech-Safi, Morocco"
38,Dar Marrakech,3.5,"403 High Street, London, England, United Kingdom"
39,Le Marrakchi,4,"52 Rue des Banques, Place Jeema el Fna, Marrakech, Marrakech-Safi, Morocco"
40,Cafe de France,3,"Place Jemaa El Fna, Marrakech, Marrakech-Safi, Morocco"
41,MY Kechmara,4.5,"3 Rue de la Liberte, Marrakech, Marrakech-Safi, Morocco"
42,Dar Essalam,4,"170, Riad Zitoune El Kedim, Marrakech, Marrakech-Safi, Morocco"
43,Atay Cafe - Food,4.5,"62, Rue Amsefah Sidi Abdelaziz, Marrakech, Marrakech-Safi, Morocco"
44,Dar Moha,4,"81, Rue Dar El Bacha, Marrakech, Marrakech-Safi, Morocco"
45,Souk Kafe,4.5,"11 Derb Souk Jeldid, Marrakech, Marrakech-Safi, Morocco"
46,Taste of Marrakech,4.5,"Governor's Parade, Gibraltar"
47,Bo Zin,4,"Route de l' Ourika 3,5 Kms, Marrakech, Marrakech-Safi, Morocco"
48,Marrakech,5,"7 Ocean St, Maroochydore, Sunshine Coast, Queensland, Australia"
49,Dar Anika Kitchen,4.5,"Riad Zitoun Kedim No 112, Marrakech, Marrakech-Safi, Morocco"
50,Bakchich Cafe,4.5,"Junction Of Rue Des Banques And Riad Zitoun El Jdid, Marrakech, Marrakech-Safi, Morocco"
51,Henna cafe,4.5,"93 Arset Aouzal Road, Dar EL Basha, Marrakech, Marrakech-Safi, Morocco"
52,Les Jardins de la Medina,4.5,"21 Derb Chtouka, Marrakech, Marrakech-Safi, Morocco"
53,Marrakech,4,"Melchor Jimenez 774, La Paz, La Paz Department, Bolivia"
54,Cafe Restaurant Argana,4.5,"Djemaa El Fna Square, Marrakech, Marrakech-Safi, Morocco"
55,Mamma Mia,4.5,"18 Rue de la Libertie, Marrakech, Marrakech-Safi, Morocco"
56,Le Trou au Mur,4.5,"39 Derb El Farnatchi, Marrakech, Marrakech-Safi, Morocco"
57,Lotus Privilege Moroccan Restaurant,4.5,"Quartier Dar El Bacha, Marrakech, Marrakech-Safi, Morocco"
58,La Cantine Des Gazelles,4.5,"6 Dabachi Kennaria, Marrakech, Marrakech-Safi, Morocco"
59,Chez Brahim,4.5,"38 Derb Dabachi, Marrakech, Marrakech-Safi, Morocco"
60,Barometre Marrakech,5,"Rue Moulay Ali Gueliz, Marrakech, Marrakech-Safi, Morocco"
61,Marrakech Artisan,5,"16 George Street, Hastings, East Sussex, England, United Kingdom"
62,Riad Kniza Restaurant,4.5,"34 Derb L'Hotel, Marrakech, Marrakech-Safi, Morocco"
63,Al Fassia Aguedal,4.5,"9bis route de l'Ourika, Marrakech, Marrakech-Safi, Morocco"
64,Cuisine De Terroir,4.5,"St Kennaria 118, Marrakech, Marrakech-Safi, Morocco"
65,Chez Mado,4.5,"Rue Moulay Ali, Marrakech, Marrakech-Safi, Morocco"
66,Le Tanjia,4.5,"Place des Ferblantiers, Marrakech, Marrakech-Safi, Morocco"
67,Bagatelle,4.5,"103, Rue de Yougoslavie, Marrakech, Marrakech-Safi, Morocco"
68,Entrepotes,4.5,"62, Rue Tarik Ibn Zyad, Marrakech, Marrakech-Safi, Morocco"
69,Le Bistro Arabe,4.5,"7/8 Derb Chaabane, Marrakech, Marrakech-Safi, Morocco"
70,La Table de La Sultana,4.5,"403 rue de la Kasbah, Marrakech, Marrakech-Safi, Morocco"
71,16 Cafe,4.5,"Place du 16 Novembre, Marrakech, Marrakech-Safi, Morocco"
72,La Table du Palais,4.5,"63, Rue Sidi El Yamani, Marrakech, Marrakech-Safi, Morocco"
73,Rooftop Restaurant Dardar,4.5,"4 Rue Riad Zitoun el Kdim, Marrakech, Marrakech-Safi, Morocco"
74,Jemaa ElFna Restaurant,4.5,"Boulevard des banques rue Zaari N 42 Kennaria, Marrakech, Marrakech-Safi, Morocco"
75,L'envers,4.5,"29 Rue Ibn Aicha, Marrakech, Marrakech-Safi, Morocco"
76,Dameh,5,"15 Gueliz rue Qadi Ayad, El Harti, Marrakech, Marrakech-Safi, Morocco"
77,Plus 61,4.5,"96 Rue Mohammed El Beqal, Marrakech, Marrakech-Safi, Morocco"
78,Le Petit Cornichon,4.5,"27, Rue Moulay Ali, Marrakech, Marrakech-Safi, Morocco"
79,Restaurant Marrakech,4,"Corner of rue Omar el Mokhtar and bd. Mohammed V, Fes, Fes-Meknes, Morocco"
80,Le TOBSIL,4.5,"22 Derb Abdellah Ben Hessaien. Ksour, Marrakech, Marrakech-Safi, Morocco"
81,Restaurant Le LOFT,4.5,"18 Rue de la Liberte, Marrakech, Marrakech-Safi, Morocco"
82,Teteria y Restaurante Marrakech,4,"Carrera Darro 49, Granada, Province of Granada, Andalucia, Spain"
83,La Patisserie des Princes,4.5,"32, rue Bab Agnaou, Marrakech, Marrakech-Safi, Morocco"
84,Dar Najat's Kitchen,4.5,"Dar Najat, Douar Graoua,, Marrakech, Marrakech-Safi, Morocco"
85,Le 68 Bar A Vin,4.5,"68, Rue de la Liberte, Marrakech, Marrakech-Safi, Morocco"
86,Cafe Mama Afrika,4.5,"Rue Oum Errabia, Marrakech, Marrakech-Safi, Morocco"
87,Palais Jad Mahal,3.5,"10 Rue Haroune Errachid, Marrakech, Marrakech-Safi, Morocco"
88,VITA NOVA,4.5,"36 Rue Ibn Aicha, Marrakech, Marrakech-Safi, Morocco"
89,Poka,5,"N 149 Residence Soluna, Rue Khalid Ben El Oualid, Marrakech, Marrakech-Safi, Morocco"
90,Les Jardins de Bala,4,"26 Rue de la Koutoubia, Marrakech, Marrakech-Safi, Morocco"
91,Dar Yacout,4,"79 Rue Sidi Ahmed Soussi, Marrakech, Marrakech-Safi, Morocco"
92,Katsura,4.5,"Rue Oum Errabia, Marrakech, Marrakech-Safi, Morocco"
93,Ksar Es Saoussan,4.5,"Rue des Ksour 3 Derb El Messaoudyenne, Marrakech, Marrakech-Safi, Morocco"
94,Palais Dar Soukkar,4.5,"3,8 KM, Route de l'Ourika, Marrakech, Marrakech-Safi, Morocco"
95,Cafe Extrablatt,4,"Angle Avenue Echouada Et Rue Alqadissia, Marrakech, Marrakech-Safi, Morocco"
96,Snack Toubkal,4,"Marrakech, Marrakech-Safi, Morocco"
97,Chez Yassine,4.5,"70 Rue Fatima Zahra, Marrakech, Marrakech-Safi, Morocco"
98,Kasbah Cafe,4,"47 Boutouil, Kasbah en Face Des Tambeaux Saadiens, Marrakech, Marrakech-Safi, Morocco"
99,Cafe Babouche,4.5,"37 Rue Des Banque, Marrakech, Marrakech-Safi, Morocco"
100,La Famille,4,"42 Riad Zitoun Jdid, Marrakech, Marrakech-Safi, Morocco"
101,Narwama,4.5,"Hay Zefriti 30, Marrakech, Marrakech-Safi, Morocco"
102,Beats Burger,4.5,"35 Souk Jeld Kimakine, Marrakech, Marrakech-Safi, Morocco"
103,La Trattoria Marrakech,4.5,"179, Rue Mohamed El Beqal Gueliz, Marrakech, Marrakech-Safi, Morocco"
104,Epicurien,4,"Rue Ibrahim El Mazini, Marrakech, Marrakech-Safi, Morocco"
105,Catanzaro,4,"42 rue Tarik Ibn Ziyad, Marrakech, Marrakech-Safi, Morocco"
106,Le Blokk,4.5,"Route des Jardins de la Palmeraie, Marrakech, Marrakech-Safi, Morocco"
107,Dar Marjana,4,"15 Derb Sidi Ali Tair, Marrakech, Marrakech-Safi, Morocco"
108,Fouquet's Marrakech,4.5,"Rue Djebel Alakhdar, Marrakech, Marrakech-Safi, Morocco"
109,Cafe Restaurant Dar L'hssira,5,"15-12 Rue Tachenbacht, Marrakech, Marrakech-Safi, Morocco"
110,Snack Grand Atlas,4.5,"Rue Ibnou Marine, Marrakech, Marrakech-Safi, Morocco"
111,La Villa Des Orangers - Restaurant,4.5,"6 rue Sidi Mimoun, Marrakech, Marrakech-Safi, Morocco"
112,Shtatto Marrakech,4.5,"81 Derb Nkhal, Rahba Lakdima, Marrakech, Marrakech-Safi, Morocco"
113,Casanova Marrakech,4.5,"Av Yacoub el Mansour, Marrakech, Marrakech-Safi, Morocco"
114,Marrakech Cafe Moroccan & Mediterranean,4,"305 Evans Bay Parade, Wellington, Greater Wellington, North Island, New Zealand"
115,El Fenn Cocktail Bar & Restaurant,4,"2 Derb Moulay Abdullah Ben Hezzian, Marrakech, Marrakech-Safi, Morocco"
116,Cafe Chez ZaZa,4.5,"21 Place Bab Fteuh, Marrakech, Marrakech-Safi, Morocco"
117,Kabana,4.5,"Rue Fatima Ezzahra R'mila, Marrakech, Marrakech-Safi, Morocco"
118,So Lounge Marrakech,4.5,"Rue Haroun Errachid, Quartier Hivernage, Marrakech, Marrakech-Safi, Morocco"
119,Fine Mama?,4.5,"89 Passage Prince Moulay Rachid, Marrakech, Marrakech-Safi, Morocco"
120,The Lotus Club,4,"Rue Ahmed Chawki, Marrakech, Marrakech-Safi, Morocco"
121,Patisserie Amandine Marrakech,4.5,"6 Rue de la Liberte, Marrakech, Marrakech-Safi, Morocco"
122,Buddha-Bar Marrakech,4,"Avenue Prince My Rachid, Marrakech, Marrakech-Safi, Morocco"
123,Cafe du Livre,4,"44 Rue Tariq Ibn Ziad, Marrakech, Marrakech-Safi, Morocco"
124,Hotel la Renaissance,3.5,"89 angle Bld Zerktouni et Mohamed V, Marrakech, Marrakech-Safi, Morocco"
125,Taj'in Darna,4,"50 Place Jamaa El Fna, Marrakech, Marrakech-Safi, Morocco"
126,Dar Chef,4.5,"Rue Kennaria N 123 Bis, Marrakech, Marrakech-Safi, Morocco"
127,Cafe Kessabine,4,"77 Souk Kessabine Jamaa Fna, Marrakech, Marrakech-Safi, Morocco"
128,L'Orangerie & Lawrence Bar - Sofitel Marrakech,4.5,"Rue Harroun Errachid, Marrakech, Marrakech-Safi, Morocco"
129,Taj Moroccan Food,5,"1 Rue Moulay Ismail, Marrakech, Marrakech-Safi, Morocco"
130,L'Adresse Jemaa El-Fna,4,"5 Rue la Koutoublia, Marrakech, Marrakech-Safi, Morocco"
131,L'Mida Marrakech,4.5,"78 bis Derb Nkhel, Rahba Kdima, Medina, Marrakech, Marrakech-Safi, Morocco"
132,La Terrasse Ben Youssef,4,"Rue Sidi Mimoun 98, Marrakech, Marrakech-Safi, Morocco"
133,MyKawa,4,"34 rue Yves St Laurent, Marrakech, Marrakech-Safi, Morocco"
134,Zeitoun Cafe Kasbah,4.5,"417 Bab Agnaou, Marrakech, Marrakech-Safi, Morocco"
135,Restaurant Oscar Progres,4,"20, rue Bani Marine, Marrakech, Marrakech-Safi, Morocco"
136,Lao Marrakech,5,"14 et, Benhafssa, 16 Rue Oued El Makhazine, Marrakech, Marrakech-Safi, Morocco"
137,Palais Soleiman,4.5,"Bd 11 Janvier, Marrakech, Marrakech-Safi, Morocco"
138,La Cuisine de Mona,4.5,"Residence Mamoune 5 n 115B, Marrakech, Marrakech-Safi, Morocco"
139,Cafe Des Epices,4,"75, Rahba Lakdima, Medina, Marrakech, Marrakech-Safi, Morocco"
140,Portofino,4,"279 Avenue Mohammed VI, Marrakech, Marrakech-Safi, Morocco"
141,L'Adresse Gueliz,4,"Avenue Mohammed VI, Marrakech, Marrakech-Safi, Morocco"
142,Le Grand Balcon Cafe Glacier,3,"Jemaa El Fna, Marrakech, Marrakech-Safi, Morocco"
143,L'O A LA BOUCHE - Marrakech,5,"4 rue Badr, Marrakech, Marrakech-Safi, Morocco"
144,Malak Emeraude,4,"Avenue Mohammed VI, Marrakech, Marrakech-Safi, Morocco"
145,LE PALACE,4,"Avenue Echouhada, Marrakech, Marrakech-Safi, Morocco"
146,Le Bougainvillier Restaurant,3.5,"33 Rue Mouassine, Marrakech, Marrakech-Safi, Morocco"
147,Mandala Society Essaouira,4.5,"Avenue de l'Istiqlal, Essaouira, Marrakech-Safi, Morocco"
148,Kech Burger,4.5,"39 Rue Mohamed El Bakkal, Marrakech, Marrakech-Safi, Morocco"
149,Bombay Marrakech,4.5,"29 Rue Ibn Aicha, Marrakech, Marrakech-Safi, Morocco"
150,Chez Lamine,4,"Rue Ibn Aicha a, Marrakech, Marrakech-Safi, Morocco"
151,Chez Chegrouni,3.5,"Place Djemaa Al Fnaa, Marrakech, Marrakech, Marrakech-Safi, Morocco"
152,Restaurant Andalous,4.5,"102 Rue Dabachi Medina, Marrakech, Marrakech-Safi, Morocco"
153,Manzil la Tortue,5,"Km12, Route de Ouarzazate, Marrakech, Marrakech-Safi, Morocco"
154,Les Premices,3,"place Jamaa fnaa, Marrakech, Marrakech-Safi, Morocco"
155,La Porte Du Monde,3.5,"Toualat Kennaria No 69, Marrakech, Marrakech-Safi, Morocco"
156,Red Marrakech,4.5,"97 Ayres Road, Stretford, Trafford, Greater Manchester, England, United Kingdom"
157,Ame et Saveurs,4.5,"38, Prince Moulay Rachid -Medina, Marrakech, Marrakech-Safi, Morocco"
158,Al Baraka,4,"1, Place Jamaa El Fna, Marrakech, Marrakech-Safi, Morocco"
159,Stalls in the Square,3.5,"Jemaa El Fna, Marrakech, Marrakech-Safi, Morocco"
160,Terrasses Des Arts,5,"5 Derb L'Hotel Bab Doukala, Marrakech, Marrakech-Safi, Morocco"
161,Cafe Jardin Majorelle Marrakech,4,"Avenue Yarcob El Mansour, Marrakech, Marrakech-Safi, Morocco"
162,Aqua,3.5,"68 Place De Jamaa El Fna Medina, Marrakech, Marrakech-Safi, Morocco"
163,L'Auberge Espagnole,4.5,"Street Corner Tarik Ibn Ziad and Moulay Ali, Marrakech, Marrakech-Safi, Morocco"
164,M Rooftop by Medina Heritage,4.5,"58, Quartier Lakssour Fhel Zefriti, Marrakech, Marrakech-Safi, Morocco"
165,Patisserie Gato,5,"Rue Hassania, gueliz, a Deux Pas De La Clinique Chifa, Marrakech, Marrakech-Safi, Morocco"
166,Restaurant Cafe Regue Jamaa,4.5,"Rue Fatima Ezzahra N91, Marrakech, Marrakech-Safi, Morocco"
167,ViaVia Morocco Marrakech,5,"3 Rue Fandak, Marrakech, Marrakech-Safi, Morocco"
168,La Palette Restaurant Marrakech,5,"24 Rue Moulay Ali, Marrakech, Marrakech-Safi, Morocco"
169,Nobu Restaurant Marrakech,4.5,"Av. Echouhada Et, Rue Du Temple, Marrakech, Marrakech-Safi, Morocco"
170,Mandala Society Marrakech,4.5,"159, Rue Riad Zaytun Jdid, Marrakech, Marrakech-Safi, Morocco"
171,marrakech cafe,4.5,"6257 E 21st St N, Wichita, Kansas"
172,Terrasse de la fontaine,4.5,"118 Rue mouassine, Marrakech, Marrakech-Safi, Morocco"
173,L'Ocean Bleu Marrakech,4.5,"Residence Le Gueliz - Imm B - Restaurant l'Ocean - Route de Targa, Marrakech, Marrakech-Safi, Morocco"
174,Kasbah Du Toubkal Restaurant,4.5,"Toubkal National Park, Imlil, Marrakech-Safi, Morocco"
175,Restaurant Mabrouka,2.5,"Rue Bab Agnaou, Marrakech, Marrakech-Safi, Morocco"
176,Restaurant Bombay Marrakech,4,"7 Rue Ibn Zaidoun, Marrakech, Marrakech-Safi, Morocco"
177,Dar tazi,4.5,"Kaat Bennahid Souk Ahel, N 44, Marrakech, Marrakech-Safi, Morocco"
178,Votre Table,5,"Kennaria Immeuble el Biaz Numero 3, Marrakech, Marrakech-Safi, Morocco"
179,Koulchi Zine,4.5,"164 Riad Zitoune Lakdim, Marrakech, Marrakech-Safi, Morocco"
180,La Table du Marche,4,"4 Angle Avenue Echouhada, Marrakech, Marrakech-Safi, Morocco"
181,Knock Knock restaurant,4.5,"Derb Ftheu Ftouh Medina, Marrakech, Marrakech-Safi, Morocco"
182,Atlas Golf Marrakech,4.5,"Route d'Amizmiz BP 2064, Marrakech, Marrakech-Safi, Morocco"
183,Terrasse Bakchich,4.5,"Talaa 294, Marrakech, Marrakech-Safi, Morocco"
184,"La Table, Royal Mansour Marrakech",4.5,"Rue Abou El Abbas Sebti, Marrakech, Marrakech-Safi, Morocco"
185,L'mdina Marrakech,5,"42 Rue Des Banque, Marrakech, Marrakech-Safi, Morocco"
186,Le 6,4.5,"Avenue Mohammed VI, Marrakech, Marrakech-Safi, Morocco"
187,Le Jardin,4,"Rue Haroun Errachid, Marrakech, Marrakech-Safi, Morocco"
188,La Creperie de Marrakech,4.5,"14 Petit Marche de Gueliz, Marrakech, Marrakech-Safi, Morocco"
189,Montecristo Marrakech,4,"20 Rue Benaicha, Marrakech, Marrakech-Safi, Morocco"
190,Dar Donab Le Restaurant,4.5,"53, Dar El Basha-Bab Doukkala, Marrakech, Marrakech-Safi, Morocco"
191,Le Warner Marrakech,4.5,"Avenue Yacoub el Marini, Marrakech, Marrakech-Safi, Morocco"
192,Restaurant Naima Marrakech,4.5,"Rue Azbest No. 30, Marrakech, Marrakech-Safi, Morocco"
193,Le Tire Bouchon Marrakech,5,"Angle Rue Loubnane et Rue Souriya Gueliz, Marrakech, Marrakech-Safi, Morocco"
194,Marrakech Salisbury,4.5,"140 Fisherton Street, Salisbury, Wiltshire, England, United Kingdom"
195,Marrakech Grill,4.5,"Denver, Colorado"
196,Jo's,4.5,"Residence Le Palacio, Marrakech, Marrakech-Safi, Morocco"
197,Bigua Cafe & Restaurant,4.5,"No 74, Rue Sidi Ishaq, Marrakech, Marrakech-Safi, Morocco"
198,Le Petit Thai,4.5,"22 Rue Tarik Ibn Ziad, Marrakech, Marrakech-Safi, Morocco"
199,Little Italy Marrakech,4.5,"48 Rue Mohamed El Beqal, Marrakech, Marrakech-Safi, Morocco"
200,Gm Cafe Gourmet,5,"Croisement Av. Moulay Hassan Et Rue Imam Malik, Marrakech, Marrakech-Safi, Morocco"
201,PERSONA Marrakech,5,"Rue des Vieux Marrakchis, Marrakech, Marrakech-Safi, Morocco"
202,Casa Lalla Restaurant,5,"Riad Zitoun Lakdime 16 Derb Jamaa, Marrakech, Marrakech-Safi, Morocco"
203,Zushi,4.5,"Avenue Mohammed VI, Marrakech, Marrakech-Safi, Morocco"
204,La Cour des Lions,4.5,"Rue Ibrahim El Mazini, Marrakech, Marrakech-Safi, Morocco"
205,A.Montana,5,"60 Derb Jdid Douar Graoua, Marrakech, Marrakech-Safi, Morocco"
206,Cantobar,4,"38/39 Avenue Moulay El Hassan, Marrakech, Marrakech-Safi, Morocco"
207,Zeitoun Gueliz,4.5,"213 Avenue Moahmed V, Marrakech, Marrakech-Safi, Morocco"
208,Las Terrazas De Andalucia,4.5,"Hotel El Andalous, Avenue du President Kennedy, Marrakech, Marrakech-Safi, Morocco"
209,Color Safra-SOUS RESERVATION,4.5,"Rue Ben Salah 3, Marrakech, Marrakech-Safi, Morocco"
210,Table de la Medina,4.5,"1 Derb Maaden Sidi Abdelaziz, Marrakech, Marrakech-Safi, Morocco"
211,Restaurant Terrasse La Medersa,4.5,"Souk Ahl Fes, Marrakesh, Maroc, Marrakech, Marrakech-Safi, Morocco"
212,La Table Ocre,5,"91 Avenue Homman Fetouaki, Marrakech, Marrakech-Safi, Morocco"
213,Cafe Caravan,4.5,"Riad Larrousse 151, Marrakech, Marrakech-Safi, Morocco"
214,Delices Strouza,5,"95 rue de Yugoslavia, Marrakech, Marrakech-Safi, Morocco"
215,Bacha Coffee,4.5,"Route Sidi Abdelaziz, Marrakech, Marrakech-Safi, Morocco"
216,My Taher,5,"9 Rue des Banques, Marrakech, Marrakech-Safi, Morocco"
217,L’Amazigh Rooftop,4.5,"38 Moulay Tayeb, Marrakech, Marrakech-Safi, Morocco"
218,Chateau Marrakech riyadh,4,"Alandalus  Mall, Ulya St, Al Ulya district Riyadh, Riyadh, Riyadh Province, Saudi Arabia"
219,Restaurant Le Marrakech Bordeaux,4,"15 rue Saint Remi, Bordeaux, Gironde, Nouvelle-Aquitaine, France"
220,Restaurant Marrakech,4,"Tafraoute Centre, Tafraoute, Souss-Massa, Morocco"
221,Nikki Beach,3.5,"Circuit de la Palmeraie, Marrakech, Marrakech-Safi, Morocco"
222,La Table de La Kasbah,4.5,"Derb Hajra, Bab Agnaou, Kasbah, Marrakech, Marrakech-Safi, Morocco"
223,The Capaldi Restaurant,4.5,"Km 39, route de Amizmiz, Marrakech, Marrakech-Safi, Morocco"
224,Dar El Walidin Chez Jamjami Monssif,4.5,"Riad Laarous, Marrakech, Marrakech-Safi, Morocco"
225,Le Pavillon De La Piscine,4.5,"Avenue Bab Jdid, Marrakech, Marrakech-Safi, Morocco"
226,Restaurante Teteria Marrakech,3.5,"Calle Espalda de San Nicolas, 9, 18010 Granada, Spain, Granada, Province of Granada, Andalucia, Spain"
227,Cafe Guerrab,4.5,"40 Souk Ablouh Jamaa Fna, Marrakech, Marrakech-Safi, Morocco"
228,Ma Maison,4.5,"64 Arset Aouzal Bab Doukkala Medina, Marrakech, Marrakech-Safi, Morocco"
229,La Paillote,4.5,"Km 4 Route d'Amizmiz, Marrakech, Marrakech-Safi, Morocco"
230,Lost in Marrakech,4.5,"156 Darb Snane, Medina, Marrakech, Marrakech-Safi, Morocco"
231,Kafe Merstan,4.5,"2 Rue Souk Chaaria Kast Benahid, Marrakech, Marrakech-Safi, Morocco"
232,Amornakoch restaurant cafe,4.5,"26 Qesabin Place Jemaa El Fna, Marrakech, Marrakech-Safi, Morocco"
233,Chili's,3.5,"Avenue Mohammed VI, Marrakech, Marrakech-Safi, Morocco"
234,La Table Al Badia at Riad Al Badia,5,"135 Derb Ahl Souss, Marrakech, Marrakech-Safi, Morocco"
235,Ling Ling Marrakech,4,"Route du Golf Royal, Marrakech, Marrakech-Safi, Morocco"
236,Fluffy,5,"91 Hommane Fetouaki, Marrakech, Marrakech-Safi, Morocco"
237,Restaurant El Bahja,4.5,"Rue Bani Marine, Marrakech, Marrakech-Safi, Morocco"
238,Mazel مزال Cafe,5,"8 Place des Ferblontiers, Marrakech, Marrakech-Safi, Morocco"
239,Le Jasmin Restaurant and Bar,4.5,"200 Rue du Mechouar, Marrakech, Marrakech-Safi, Morocco"
240,Queen Atlantic,4.5,"Place Du 16 Novembre, Marrakech, Marrakech-Safi, Morocco"
241,O Mammy Burger Marrakech,4,"Interieur du Complexe Prestigia Avenue Mohamed VI, Marrakech, Marrakech-Safi, Morocco"
242,monquotidien Gueliz,4.5,"41-43 Rue Yougoslavie, Marrakech, Marrakech-Safi, Morocco"
243,Quattro Marrakech,4.5,"1 Boulevard de la Menara, Marrakech, Marrakech-Safi, Morocco"
244,Cafe - Restaurant Bab Ftouh,4.5,"64 place Ftouh Marrakech GSM, Marrakech, Marrakech-Safi, Morocco"
245,Marrakech,4.5,"370 Evans Bay Parade, Wellington, Greater Wellington, North Island, New Zealand"
246,Restaurant Max by Riad Elisa,4.5,"21 rue Sidi Lyamani Ksour, Marrakech, Marrakech-Safi, Morocco"
247,Layali Karoun Iranian Restaurant,4.5,"1 Rue Ibn Habbous, Marrakech, Marrakech-Safi, Morocco"
248,Saladbox,4.5,"2 Avenue Yacoub El marini, Marrakech, Marrakech-Safi, Morocco"
249,Souk,3.5,"27 Litchfield Street, London, England, United Kingdom"
250,Le Charly's Cabana,4,"39,Bd Zerktouni,, Marrakech, Marrakech-Safi, Morocco"
251,Winoo,4,"77, Corner of Rue Mauritania and Bd Moulay Rachid, Marrakech, Marrakech-Safi, Morocco"
252,Falafel Terrace,5,"Rue Fatima Zahra 21, Marrakech, Marrakech-Safi, Morocco"
253,Le relais du Lac Marrakech,4.5,"Barrage, Marrakech, Marrakech-Safi, Morocco"
254,Marrakesh Restaurant,4.5,"King Abdullah Street, Al Khobar, Eastern Province, Saudi Arabia"
255,Piu Piu Marrakech,4.5,"10 Rue Oued El Makhazine, Marrakech, Marrakech, Marrakech-Safi, Morocco"
256,Les Jardins Du Lotus,4,"6, Derb Sidi Al Benhamdouch,, Marrakech, Marrakech-Safi, Morocco"
257,Marjana Terrasse Restaurant,5,"39 Rue Bab Agnaou Prince, Marrakech, Marrakech-Safi, Morocco"
258,"Sesamo, Royal Mansour Marrakech",4.5,"Rue Abou Abbas El Sebti, Marrakech, Marrakech-Safi, Morocco"
259,EL PHOENICIO Marrakech,4.5,"1572 Residence Prestige, 6 Rue Hafid Ibrahim, Hivernage, Marrakech, Marrakech-Safi, Morocco"
260,Momo,4,"25 Heddon Street, London, England, United Kingdom"
261,Le Makassar,4.5,"20, Derb Chtouka, Marrakech, Marrakech-Safi, Morocco"
262,Koya,4,"Avenue Echouhada, Marrakech, Marrakech-Safi, Morocco"
263,Marrakesh,4.5,"12 Vickers Lane, Louth, Lincolnshire, England, United Kingdom"
264,La Brioche Cafe Kech,4,"Place Jemaa El Fna, rue Moulay Ismail, Marrakech, Marrakech-Safi, Morocco"
265,Restaurant Angsana Si Said,5,"24, Derb Si Said, Marrakech, Marrakech-Safi, Morocco"
266,Cafe restaurant Tiznit,4.5,"No 28 Place Jemaa El Fna Kassabine, Marrakech, Marrakech-Safi, Morocco"
267,La Maison Berbere,4.5,"No 21 5-6, Marrakech, Marrakech-Safi, Morocco"
268,Mechoui Alley,4.5,"Derb Semmarine, Marrakech, Marrakech-Safi, Morocco"
269,L'Escapade Marrakech,4,"240 Angle Avenue Mohammed 5 et rue Oum Erabie, Marrakech, Marrakech-Safi, Morocco"
270,Yazel,5,"131 Rue Mouassine, Marrakech, Marrakech-Safi, Morocco"
271,Azyr,4.5,"28 Rue Ibn Al Banna, Marrakech, Marrakech-Safi, Morocco"
272,Restaurant Dar Rhizlane,4,"Avenue Jnane El Harti, Marrakech, Marrakech-Safi, Morocco"
273,Riad Omar,3,"22, rue Bab Agnaou, Marrakech, Marrakech-Safi, Morocco"
274,Dino Gelato Italiano,4,"Avenue Mohammed VI, Marrakech, Marrakech-Safi, Morocco"
275,Restaurant Marrakesh,4,"Morocco Pavilion, Orlando, Florida"
276,Marrakech Restaurante,5,"Calle 19 #3 93, Santa Marta, Santa Marta Municipality, Magdalena Department, Colombia"
277,Palais Gharnata,4.5,"5, Derb El Arsa Riad Zitoun Jdid, Marrakech, Marrakech-Safi, Morocco"
278,Restaurant Le Selman,4.5,"B.P. 24530 Marrakech Atlas, Km 5 Route d'Amizmiz, Marrakech, Marrakech-Safi, Morocco"
279,Casa Jose Marrakech,4,"8, Rue Oued el Makhazine, Marrakech, Marrakech-Safi, Morocco"
280,LA CASA Restaurant Lounge,4.5,"Avenue du President Kennedy , Hivernage, Marrakech, Marrakech-Safi, Morocco"
281,L’Italien par Jean-Georges,3.5,"Avenue Bad Jdid, Marrakech, Marrakech-Safi, Morocco"
282,EAT ME KECH Thai Cuisine,5,"10 Rue Sourya Gueliz, Marrakech, Marrakech-Safi, Morocco"
283,Chez Abdelhay,4.5,"Place El Baroudiyine 43 46, Marrakech, Marrakech-Safi, Morocco"
284,Le Zinc,4.5,"517 Avenue principale - Q.I Sidi Ghanem, Marrakech, Marrakech-Safi, Morocco"
285,Canvas Bistro,4.5,"N64, Taoulat Ben Saleh, Marrakech, Marrakech-Safi, Morocco"
286,Le Marrakech,3.5,"Kellerbleek 10, Hamburg, Germany"
287,Le Marrakech,3.5,"6 avenue de la Mandallaz, Annecy, Haute-Savoie, Auvergne-Rhone-Alpes, France"
288,Dada,4,"45 William St S, Dublin, County Dublin, Ireland"
289,Broc The Kasbah,5,"300 souika Riad Laarousse, Marrakech, Marrakech-Safi, Morocco"
290,Chez Fatima Berbere,4.5,"Riad Laarous, Marrakech, Marrakech-Safi, Morocco"
291,Ait Bougumez,4.5,"Rue Bani Marine No. 1, Imm. Zoubair, Marrakech, Marrakech-Safi, Morocco"
