,resto name,mark,location
292,Cafe Restaurant Dar Touareg,4.5,"N_ 30 Rue Touareg Jdad, Marrakech, Marrakech-Safi, Morocco"
293,La Porte de Marrakech,4,"Riad Zitoun Jdid, Marrakech, Marrakech-Safi, Morocco"
294,La table de Marrakech,4,"178 Hay Essalame, Marrakech, Marrakech-Safi, Morocco"
295,Aicha,4,"Place Djemaa El Fna, Marrakech, Marrakech-Safi, Morocco"
296,Dar Belkabir,4,"12, Souk Des Roseaux, Marrakech, Marrakech-Safi, Morocco"
297,Al Fassia Gueliz Restaurant,4,"55 Boulevard Mohamed Zerktoun, Marrakech, Marrakech-Safi, Morocco"
298,Restaurant El Badia,3.5,"KM6, Route du Barrage Cherifia, Marrakech, Marrakech-Safi, Morocco"
299,Jnane Tamsna,4.5,"Douar Abiad, Marrakech, Marrakech-Safi, Morocco"
300,Wich is Wich: New style. Home style. Food.,4,"140 Fullarton St, London, Ontario, Canada"
301,Les Terrasses de l'Alhambra,3,"Place Jemaa el-Fna, Marrakech, Marrakech-Safi, Morocco"
302,Le Pavillon - Selman Marrakech,4,"Km 5 Route d'Amizmiz, Marrakech, Marrakech-Safi, Morocco"
303,Restaurant Dar Nejjarine,3.5,"35. Derb Sahrij riad el moukha marrakech, Marrakech, Marrakech-Safi, Morocco"
304,Starbucks,2.5,"Avenue Mohammed VI, Marrakech, Marrakech-Safi, Morocco"
305,Marrakech Delight,4,"13 Church Lane, London, England, United Kingdom"
306,Le Marrakech,4,"11 Place de la Motte, Limoges, Haute-Vienne, Nouvelle-Aquitaine, France"
307,Marrakesh,4.5,"517 S Leithgow St, Philadelphia, Pennsylvania"
308,La table du Riad Idra,5,"105 Derb Tizougarine, Marrakech, Marrakech-Safi, Morocco"
309,Amanjena Arva Italian Restaurant,4.5,"Route de Ouarzazate, Marrakech, Marrakech-Safi, Morocco"
310,Luma,5,"Boulevard Mohamed VI, Marrakech, Marrakech-Safi, Morocco"
311,Al Bahriya Seafood Restaurant,4,"75 Bis Av. Moulay Rachid, Marrakech, Marrakech-Safi, Morocco"
312,Le Marrakech,4,"4752b West Swan Rd, West Swan, Swan Valley, Greater Perth, Western Australia, Australia"
313,Restaurant Marrakech,4,"12 rue d Armaille, Paris, Ile-de-France, France"
314,La Table Espagnole Marrakech,2.5,"34 Rue de la Liberte, Marrakech, Marrakech-Safi, Morocco"
315,Fanatic,3,"Boulevard Mohamed V, Essaouira, Marrakech-Safi, Morocco"
316,Marrakech Moroccan Restaurant,3.5,"Agadir, Souss-Massa, Morocco"
317,Le Marrakech,4,"13 avenue General Champon, Grenoble, Isere, Auvergne-Rhone-Alpes, France"
318,GON'S Chicken,4.5,"Av. Hassan II, Marrakech, Marrakech-Safi, Morocco"
319,La Fourchette de Dakar,5,"40 Rue kenaria, Marrakech, Marrakech-Safi, Morocco"
320,Fish house Al Aachabe,5,"Av. Yacoub El Mansour, Marrakech, Marrakech-Safi, Morocco"
321,Ksar El Kabbaba,5,"El Kabbaba El Khamssa, Ouarzazate, Draa-Tafilalet, Morocco"
322,Le Marocain,4,"Avenue Bab Jdid, Marrakech, Marrakech-Safi, Morocco"
323,Restaurant Cafe Palais El Badi,4,"4 Rue Touareg Berrima Bab Mellah, Marrakech, Marrakech-Safi, Morocco"
324,Softy Sweet,4.5,"Rue Ibn Toumerte Et Souraya, Marrakech, Marrakech-Safi, Morocco"
325,Oban,5,"31-33, Derb Jdid, Bab Doukkala, Marrakech, Marrakech-Safi, Morocco"
326,Le Saadi,4.5,"Rue Ibrahim El Mazini, Marrakech, Marrakech-Safi, Morocco"
327,Clay Oven Marrakech,4,"35 Avenue Hassan 2 Gueliz, Marrakech, Marrakech-Safi, Morocco"
328,Les Terrasses de Marrakech,4,"Rue du Riad Zitoune, Marrakech, Marrakech-Safi, Morocco"
329,Grillade Al Baite Chami,4.5,"Med V No 1, Marrakech, Marrakech-Safi, Morocco"
330,Grillade Al Baite Chami,4.5,"Med V No 1, Marrakech, Marrakech-Safi, Morocco"
331,Restaurant Wazani,5,"N_2, Rue des Banques, Marrakech, Marrakech-Safi, Morocco"
332,Chez Mariama Berbere,4.5,"Riad Laarousse N 100, Marrakech, Marrakech-Safi, Morocco"
333,Le Marrakech,4.5,"40 avenue de Paris, Royan, Charente-Maritime, Nouvelle-Aquitaine, France"
334,Dar ima,4,"11 rue de la liberte Guiliz, Marrakech, Marrakech-Safi, Morocco"
335,Terrasse des Teinturiers,4.5,"8 Souk Dellaouine , Sebaghine, Marrakech Medina, Marrakech, Marrakech-Safi, Morocco"
336,Wok Bangkok,4.5,"Residence Amira 14, Marrakech, Marrakech-Safi, Morocco"
337,Chez Eduardo,4.5,"12 Rue Lobnane, Marrakech, Marrakech-Safi, Morocco"
338,O'Mulligan Pub Restaurant,4,"Avenue Hassan II, Marrakech, Marrakech-Safi, Morocco"
339,Djelabar,4,"2 rue Abou Hanifa, Marrakech, Marrakech-Safi, Morocco"
340,Islane Hotel Restaurant,3.5,"279 Av Avenue Mohammed VI, Marrakech, Marrakech-Safi, Morocco"
341,Kosybar,4,"Kzadria, Marrakech, Marrakech-Safi, Morocco"
342,La Ferme Medina Restaurant,4,"Riad Laarouss, Marrakech, Marrakech-Safi, Morocco"
343,La Terrasse de La Brillante - Rooftop,5,"Rue Bahia 6, Riad Zitoun Jdid, Marrakech, Marrakech-Safi, Morocco"
344,Le Marrakech,5,"1-17-7 Oyodonaka, Kita-ku, Osaka, Osaka Prefecture, Kinki, Japan"
345,JAMA,4,"Rue Riad Zitoune el Jdid, Marrakech, Marrakech-Safi, Morocco"
346,Ce soir on dine a Marrakech,3.5,"Avenue Brugmann 408, Brussels, Belgium"
347,Boca Grande Marrakech,4.5,"Avenue Yacoub el Marini, Marrakech, Marrakech-Safi, Morocco"
348,Dabachi Chez Cherif,4.5,"Derb Dabachi, Marrakech, Marrakech-Safi, Morocco"
349,Shirvan,4.5,"Route du Golf Royal, Marrakech, Marrakech-Safi, Morocco"
350,Dar Mima,4.5,"9, derb Zaouia el Kadiria, Marrakech, Marrakech-Safi, Morocco"
351,l'ancien cafe,3.5,"8 Kessariat Kanaria, Marrakech, Marrakech-Safi, Morocco"
352,El Kennaria Restaurant,4.5,"10 Rue El Kennaria, Marrakech, Marrakech-Safi, Morocco"
353,Restaurante Marrakech,4,"Av. de Canovas del Castillo 12, Malaga, Costa del Sol, Province of Malaga, Andalucia, Spain"
354,Eclipse Rooftop,5,"186, Derb chtouka, Marrakech, Marrakech-Safi, Morocco"
355,Cafe Medina Rouge,4.5,"28 Rue Koutoubia, Marrakech, Marrakech-Safi, Morocco"
356,Cafe l'artisan,4.5,"37 Rue Des Banque, Marrakech, Marrakech-Safi, Morocco"
357,Riad Ben Tachfine,5,"227 Derb Jdid, Marrakech, Marrakech-Safi, Morocco"
358,Le Mart,5,"Leather Market, 35, Kimakhine, Marrakech, Marrakech-Safi, Morocco"
359,Snack Les 7 Saints,3,"Place Jema EF N'a, Marrakech, Marrakech-Safi, Morocco"
360,Juliette & chocolat marrakech,4,"Imm1 n3 quartier l'hivernage angle Mohammed VI et Moulay Hassan, Marrakech, Marrakech-Safi, Morocco"
361,Restaurant El Bahia,3.5,"1, Rue Riad Zitoun El Jedid Pres Du Palais El Bahia, Marrakech, Marrakech-Safi, Morocco"
362,Patron de la Mer Restaurant,4,"Rue Oued El Makhazine, Angle Imam Chafai, Marrakech, Marrakech-Safi, Morocco"
363,Palais Chahramane,2.5,"6 rue Sidi Bouchouka arset lamaache, Marrakech, Marrakech-Safi, Morocco"
364,Kafe Fnacque Berbere,4,"Derb Ksour, Marrakech, Marrakech-Safi, Morocco"
365,Restaurant MB Marrakech,5,"N 149 Rue Khalid Ben El Oualid Gueliz, Marrakech, Marrakech-Safi, Morocco"
366,Ksar El Hamra,4,"28 Riad Zitoune Lakdim, Marrakech, Marrakech-Safi, Morocco"
367,Fogo de Chao,4,"Circuit de la palmeraie, Marrakech, Marrakech-Safi, Morocco"
368,Nid'cigogne,4,"60, Place des Tombeaux Saadiens, Marrakech, Marrakech-Safi, Morocco"
369,Iraki Shawarma,4.5,"Derb Dabashi, Marrakech, Marrakech-Safi, Morocco"
370,Restaurant Chaabi,4.5,"Jamaa lafna bani marine n 35, Marrakech, Marrakech-Safi, Morocco"
371,Le Marrakech,4,"Rue Monge, Dijon, Cote d'Or, Bourgogne-Franche-Comte, France"
372,Stylia,4,"34 Rue Ksour Marrakech Medina, Marrakech, Marrakech-Safi, Morocco"
373,Bistrot Romain,4,"Place Du 16 Novembre, Marrakech, Marrakech-Safi, Morocco"
374,Matcha Marrakech,5,"Atar 1 Mag N 2 Angle Av Med 5 et rue Mouatamid ben Abad, Marrakech, Marrakech-Safi, Morocco"
375,Akira Back Marrakech,4.5,"M Avenue Hivernage, Marrakech, Marrakech-Safi, Morocco"
376,Restaurant du Grand Hotel Tazi,2,"Angle Av. El Mouahidine Et Rue Bab Agnaou, Marrakech, Marrakech, Marrakech-Safi, Morocco"
377,IDIL Oriental Restaurant,5,"18 Rue de la Liberte, Marrakech, Marrakech-Safi, Morocco"
378,Mod Milano 1933,4,"Av. Ibn Al Khattib, Marrakech, Marrakech-Safi, Morocco"
379,Chez Aicha,4,"Jemaa el-Fna square, Marrakech, Marrakech-Safi, Morocco"
380,Le Flouka,4,"Le Flouka, Marrakech, Marrakech-Safi, Morocco"
381,Arkech,4,"L'hivernage Marrakech, Marrakech, Marrakech-Safi, Morocco"
382,La Gironde,4.5,"83 Lot du Centre Ouarzazate, Ouarzazate, Draa-Tafilalet, Morocco"
383,Ourika Garden,5,"Vallee de l'Ourika Aghbalou, Ourika, Marrakech-Safi, Morocco"
384,Restaurant le Mediterranee,4.5,"8 Rue Oued El Makhazine Harti, Marrakech, Marrakech-Safi, Morocco"
385,Al Jawda,5,"Avenue Golf, Marrakech, Marrakech-Safi, Morocco"
386,The Sandwich Factory,4.5,"1 Rue Les Vieux Marrakchis, Marrakech, Marrakech-Safi, Morocco"
387,L'assiette du Boucher,4.5,"Avenue Echouhada, Marrakech, Marrakech-Safi, Morocco"
388,Le Chineur,4.5,"Boulevard el Mansour Eddahbi, Marrakech, Marrakech-Safi, Morocco"
389,Jad Jamal,3.5,"N 91, Ibn Youssef, Marrakech, Marrakech-Safi, Morocco"
390,Dar Mimoun,4,"1 Derb Ben Amrane, Marrakech, Marrakech-Safi, Morocco"
391,Dar El Baroud,3,"275 Avenue Mohammed VI, Marrakech, Marrakech-Safi, Morocco"
392,Rooftop Garden,4,"Angle Avenue Echouhada et Rue des Temples, Marrakech, Marrakech-Safi, Morocco"
393,L’Oasis D’Or,2.5,"Douar Kasbah Ait ben Haddou, Ait Ben Haddou, Souss-Massa, Morocco"
394,Cafe Snack Riad laarous,4,"Sidi Bou Amar, Marrakech, Marrakech-Safi, Morocco"
395,Marrakesh by mindo,4.5,"121-122 Capel Street, Dublin, County Dublin, Ireland"
396,Restaurant Tinmel,5,"1 & 4 Derb Khettara-Kaa, Marrakech, Marrakech-Safi, Morocco"
397,McDonald's,3,"Bd Mohammed V, Marrakech, Marrakech-Safi, Morocco"
398,Central Food,3.5,"172 Avenue Mohammed VI, Marrakech, Marrakech-Safi, Morocco"
399,KFC,2.5,"Jamba El Fna, Avenue El Mouahidine, Marrakech, Marrakech-Safi, Morocco"
400,Relais du Lac,4,"Barrage Lalla Takerkoust, Lalla Takerkoust, Marrakech-Safi, Morocco"
401,Restaurant Cherif,3,"18 Rue Banqu Kenaria Medina, Marrakech, Marrakech-Safi, Morocco"
402,Bianco Ice,3.5,"Prolongement Avenue Med VI Zone Touristique D' Agdal, Marrakech, Marrakech-Safi, Morocco"
403,Snack Cafe Oslo,3.5,"Rue Riad Zitoune el Jdid,place JAMAA EL FNA Medina, Marrakech, Marrakech-Safi, Morocco"
404,The Moorish,4.5,"166 Rue Mouassine, Marrakech, Marrakech-Safi, Morocco"
405,Le Dragon d'Or,3,"10 Bis, Bd Zerktouni, Marrakech, Marrakech-Safi, Morocco"
406,La Grillardiere,4,"150 rue Ibn Hanbal Gueliz, Marrakech, Marrakech-Safi, Morocco"
407,Paul Menara Mall,2.5,"Avenue Mohammed VI, Marrakech, Marrakech-Safi, Morocco"
408,Cafe Atlas,4,"Corner of Boulevard Mohamed V and Boulevard Zerktouni, Marrakech, Marrakech-Safi, Morocco"
409,Restaurant Place Des Saveurs,4,"Quartier Juife Bab, Marrakech, Marrakech-Safi, Morocco"
410,Mythe Restaurant,4,"33/35 Place Jammm El Fna, Marrakech, Marrakech-Safi, Morocco"
411,Le Cercle - Billard Cafe,4.5,"29 Rue Benaicha, Marrakech, Marrakech-Safi, Morocco"
412,La Maison Arabe,5,"Quartier Mansour Eddahbi, Ouarzazate, Draa-Tafilalet, Morocco"
413,Al Rimal,5,"43 Derb Fhal Ezzafriti, Marrakech, Marrakech-Safi, Morocco"
414,Fritos,4.5,"23 Avenue Fatima Zahaa, Marrakech, Marrakech-Safi, Morocco"
415,Le Lion d'Or Atlas,4.5,"P1506, Telouet, Souss-Massa, Morocco"
416,Razane,5,"53 Rue Mohammed El Beqal, Marrakech, Marrakech-Safi, Morocco"
417,Medina Heritage,5,"58 angle Rue El Ksour et, Rue Fhal Zefriti, Marrakech, Marrakech-Safi, Morocco"
418,BEY 961,5,"45 Rue De Yougslavie, Marrakech, Marrakech-Safi, Morocco"
419,Chez Madame Khadija,5,"Rue Amsafah, Marrakech, Marrakech-Safi, Morocco"
420,Restaurant Ba-Bouche,4.5,"Rue dar el bacha route sidi abdelaziz, Marrakech, Marrakech-Safi, Morocco"
421,African-chic,3.5,"6 rue Oum Errabia, Marrakech, Marrakech-Safi, Morocco"
422,Cafe Elite Menara Mall,3,"Rue El Imam Malik, Marrakech, Marrakech-Safi, Morocco"
423,Moorish Lounge,4.5,"447 Streatham High Road, London, England, United Kingdom"
424,La Perle Blanche,4.5,"247 Rue Fatima Zouhra Swika Bab Doukkalla, Marrakech, Marrakech-Safi, Morocco"
425,Earth Cafe Marrakech,4,"N 2 Derb Zitoun Elkdim Medina, Marrakech, Marrakech-Safi, Morocco"
426,Majorelle Restaurant,5,"08 Rue Khalid Bnoulwalid, Marrakech, Marrakech-Safi, Morocco"
427,"Fine de Marrakech, cremerie & patisserie",4.5,"Avenue Houmane Fettaouaki Syba, Marrakech, Marrakech-Safi, Morocco"
428,Cafe Bistro Laksour,4,"Boulevard Fatima Zahra, Marrakech, Marrakech-Safi, Morocco"
429,L'Ardoise du Marche,4.5,"Rue Oummo el Banin, Marrakech, Marrakech-Safi, Morocco"
430,Cafe Resto Les Almoravides,4.5,"60 el Baroudiin Ben Youssef Place, Marrakech, Marrakech-Safi, Morocco"
431,Mani A Mano,4.5,"rue El Imam Chaffi, Marrakech, Marrakech-Safi, Morocco"
432,Bazz'Art Lounge,4.5,"Rue Haroun Errachid, Marrakech, Marrakech-Safi, Morocco"
433,Le Kilim,4.5,"No 3 REZ-DE-CHAUSSEE, Immeuble Dani 36 Sis Angle Rue La Liberte & Rue Tarik Ben Ziad, Marrakech, Marrakech-Safi, Morocco"
434,Chez Ouazzani,4,"Rue Benaicha, Marrakech, Marrakech-Safi, Morocco"
435,dar yakut,4,"79, Derb Sidi Ahmed Soussi / Bab Doukkala -, Marrakech, Marrakech-Safi, Morocco"
436,Le Relais de Paris,4,"Hotel Les Jardins de La Koutoubia, Marrakech, Marrakech-Safi, Morocco"
437,La Table Du Marche Gourmet Market Menara Mall,4,"Corner Avenue Prince Moulay Rachid and Avenue Mohammed VI, Marrakech, Marrakech-Safi, Morocco"
438,Sky Bar Armani,4,"Gueliz Marrakech, Marrakech, Marrakech-Safi, Morocco"
439,Yamy's,4,"111 Place Jamaa El Fna, Marrakech, Marrakech-Safi, Morocco"
440,Dar Essalam,4,"170 Riad Zitoun Kedim, Marrakech, Marrakech-Safi, Morocco"
441,Snack la place,4,"Place Jma El Fna, Marrakech, Marrakech-Safi, Morocco"
442,Restaurant Place des Ferblantiers,3.5,"12 Place des Ferblantiers, Marrakech, Marrakech-Safi, Morocco"
443,Moroccan Dinner Show,3,"Rue Ibrahim El Mazini, Marrakech, Marrakech-Safi, Morocco"
444,Restaurant Gastronomique,4.5,"Ibrahim El Mazini, Marrakech, Marrakech-Safi, Morocco"
445,Cafe Baganziz,4.5,"Rue Des Banque, Marrakech, Marrakech-Safi, Morocco"
446,Nuvo Restaurant Lounge,4.5,"Rue el imam malik, Marrakech, Marrakech-Safi, Morocco"
447,World Storytelling Cafe Vegan,5,"93 Souk Al Fassis, Marrakech, Marrakech-Safi, Morocco"
448,Restaurant Elzguerona,5,"Route Ourika km 54,5, Ourika, Marrakech-Safi, Morocco"
449,Projet M,5,"Angle Ibn Hanbal, Marrakech, Marrakech-Safi, Morocco"
450,Cafe Restaurant Chez l'Habitant,5,"Km 23 Route de Sidi Rahal, Marrakech, Marrakech-Safi, Morocco"
451,Lila Gueliz,4.5,"166-176 avenue Mohamed V, Marrakech, Marrakech-Safi, Morocco"
452,Riad Al Kadar,5,"132 , Derb Jamaa, Marrakech, Marrakech-Safi, Morocco"
453,Restaurant La Terrasse Du Marche,4.5,"114 Rue Houmane Fetouaki, Marrakech, Marrakech-Safi, Morocco"
454,Restaurant Le Grand Bazar,5,"RUE EL GUASSABINE, Marrakech, Marrakech-Safi, Morocco"
455,Chez Ben Driss,4,"Place Jamaa El Fna No 50, Marrakech, Marrakech-Safi, Morocco"
456,La Fromagerie,4.5,"Douar Larabe, Essaouira, Marrakech-Safi, Morocco"
457,Bendoo,4,"Avenue Echouhada, Marrakech, Marrakech-Safi, Morocco"
458,Cafe Snack Chinguitti,4,"107 Rahba Lakdima, Marrakech, Marrakech-Safi, Morocco"
459,Le Petit Chinois,4,"Rue du Jbel Sarho, Marrakech, Marrakech-Safi, Morocco"
460,Kfe BD,4,"Derb Ftheu, Marrakech, Marrakech-Safi, Morocco"
461,Restaurant Palais Sebban,4,"43, Derb My Abdellah Ben Hsseine, Quartier Laksour Mediana, Marrakech, Marrakech-Safi, Morocco"
462,Amore Italiano,3.5,"Route de l'Ourika, Marrakech, Marrakech-Safi, Morocco"
463,Turkish SteakHouse,4,"47 Residence Almarwa Rue De Loubnane, Marrakech, Marrakech-Safi, Morocco"
464,Pastaz by Catanzaro,3.5,"27 rue Imam Chafai, Marrakech, Marrakech-Safi, Morocco"
465,Le Carioca,3.5,"120, rue Med al Baqual Residence M'barka, Marrakech, Marrakech-Safi, Morocco"
466,El Waha,3,"1, riad Zitoun el Kedim, Marrakech, Marrakech-Safi, Morocco"
467,Cafe Lobo,3.5,"Av Med 6 Residence des Oliviers, Marrakech, Marrakech-Safi, Morocco"
468,Restaurant Diaffa,3.5,"1 Rue Jbel Lakhdar, Marrakech, Marrakech-Safi, Morocco"
469,Brasserie La Renaissance,3,"89 angle boulevard Zerktouni et boulevard Mohamed V Marrakech, Marrakech, Marrakech-Safi, Morocco"
470,Fishermens Huts,3,"Fishermans Huts Entrance to the Port, Essaouira, Marrakech-Safi, Morocco"
471,Restaurant Art & Emotions,5,"2 Rue Riad Zitoun El-Kdim, Marrakech, Marrakech-Safi, Morocco"
472,Malah Cafe And Restaurant,5,"23 place des Ferblantiers, Marrakech, Marrakech-Safi, Morocco"
473,Dar Naima Restaurant,5,"1, Derb El Ouartani, Mouassine, Marrakech, Marrakech-Safi, Morocco"
474,Da Gino,4.5,"Boulevard Mohamed VI, Marrakech, Marrakech-Safi, Morocco"
475,Caravane Cafe,4.5,"2 Bis, Rue Du Qadi Ayad, Essaouira, Marrakech-Safi, Morocco"
476,Pik-Nik Snack,4,"Bld. El Mouhidine, N 6 a 50 M D'hotel Tazi, Marrakech, Marrakech-Safi, Morocco"
477,Tagine - One&Only Royal Mirage,4,"Al Sufouh Road, Dubai, Emirate of Dubai, United Arab Emirates"
478,Rustic,4,"300 Via Archimedes, Geyserville, Sonoma County, California"
479,Les Terrasses de Jemaa El Fna,5,"Boulevard des Banques rue Zaari N 32, Marrakech, Marrakech-Safi, Morocco"
480,Pizza Hut,3,"6 Boulevard Mohamed V, Marrakech, Marrakech-Safi, Morocco"
481,Amatto,4,"57, Rue de Paris, Marrakech, Marrakech-Safi, Morocco"
482,Manchego Bar Lounge,3.5,"Avenue Mohammed VI, Marrakech, Marrakech-Safi, Morocco"
483,Bella Italia,4,"Avenue Mohammed VI, Marrakech, Marrakech-Safi, Morocco"
484,Les Jardins du Gueliz,4,"Rue Oued Makhzine, Marrakech, Marrakech-Safi, Morocco"
485,Riad & Spa Mabrouk,3.5,"Rue Bani Marine, Marrakech, Marrakech-Safi, Morocco"
486,Riad Dar Tim Tam,3,"42 44, Rue Rahba Lakdima, Marrakech, Marrakech-Safi, Morocco"
487,Cafe Restaurant Atlas,3,"Sidi el Mokhtar, Essaouira, Marrakech-Safi, Morocco"
488,Les Negociants,4,"Angle Avenue Mohammed V-Boulevard Mohamed Zerktouni, Marrakech, Marrakech-Safi, Morocco"
489,La Table de la Koutoubia,4,"Av. Mohammed V, Marrakech, Marrakech-Safi, Morocco"
490,Food Zone,5,"3 Avenue Hassan II, Marrakech, Marrakech-Safi, Morocco"
491,L'Atelier Cuisine,4.5,"8 Rue Oued El Makhazine, Gueliz,, Marrakech, Marrakech-Safi, Morocco"
492,Riad Les Oliviers restaurant,4.5,"47 - 48 Rue de la Bahia, Marrakech, Marrakech-Safi, Morocco"
493,Khamsa,4.5,"1503 15th St, San Francisco, California"
494,L' O a la Bouche,4.5,"les Aires, Bauduen, Var, Provence-Alpes-Cote d'Azur, France"
495,Pinnochio Gelato,4.5,"226 Sidi Abbad, Marrakech, Marrakech-Safi, Morocco"
496,Le Petit Napolitain,5,"Mohammed El Beqqal, Marrakech, Marrakech-Safi, Morocco"
497,Valse,4.5,"RDC Residence City Garden, Rue Yougoslavie, Marrakech, Marrakech-Safi, Morocco"
498,NIAMA Snack Restaurant,4.5,"Rue Riad Zitoune Lakdim, Marrakech, Marrakech-Safi, Morocco"
499,Restaurant Gargot,4.5,"12 rue Bani Marine, Marrakech, Marrakech-Safi, Morocco"
500,Restaurant Lafarmacie,5,"Place Jeema El Fna, 52 Rue Des Banques, Marrakech, Marrakech-Safi, Morocco"
501,La Pronto Pizza,5,"Rue Mohamed El Beqal, Marrakech, Marrakech-Safi, Morocco"
502,The Queen Victoria,4.5,"Rue Guemassa, Marrakech, Marrakech-Safi, Morocco"
503,KECH - Moroccan Mezze Bar,4.5,"Rua Afonso Sanches 47 A1, Cascais, Lisbon District, Central Portugal, Portugal"
504,Restaurant Dar Baraka,5,"5 Db My Abdallah Ahd Suezzara, Meknes, Fes-Meknes, Morocco"
505,Babakish - Restaurant Libanais Marrakech,4.5,"66 Rue Tarik Ibn Ziad, Marrakech, Marrakech-Safi, Morocco"
506,The Original Camp Agafay,5,"Agafay, Marrakech-Safi, Morocco"
507,La Collegiale,4.5,"78 Boulevard HASSAN II, Marrakech, Marrakech-Safi, Morocco"
508,El Beyrouti,4.5,"10 rue El Kennaria, Marrakech, Marrakech-Safi, Morocco"
509,Casa Del Jefe,4.5,"Boulevard Moulay Rachid, Marrakech, Marrakech-Safi, Morocco"
510,Iouifood,5,"Bab Agnaw, Marrakech, Marrakech-Safi, Morocco"
511,Ourika Organic Kitchen,5,"Douar Ait Bounit, Sidi Abdellah Ghiate, Ourika, Marrakech-Safi, Morocco"
512,Marrakesh,4,"2334 2nd Ave, Seattle, Washington"
513,Caftan,4.5,"37 Avenue Pasteur, Luxembourg City, Luxembourg"
514,Marrakech Restaurante Las Palmas,4,"Calle Juan Manuel Duran Gonzalez, 46, Las Palmas de Gran Canaria, Gran Canaria, Canary Islands, Spain"
515,La Perle du Liban Marrakech,4.5,"Angle Av. El Mouahiddine et, Rue Bani Marine, Marrakech, Marrakech, Marrakech-Safi, Morocco"
516,Palace Darkum - Sofitel Marrakech,4.5,"Rue Harroun Errachid, Marrakech, Marrakech-Safi, Morocco"
517,#14,4,"Djemaa el-Fna, Marrakech, Marrakech-Safi, Morocco"
518,Bejganni,4,"Rue Benaicha, Marrakech, Marrakech-Safi, Morocco"
519,Chesterfield Pub,3.5,"115 Avenue Mohammed VI, Marrakech, Marrakech-Safi, Morocco"
520,Chez El Bahia,4,"Riad Zitoune El Kdim, 206, Marrakech, Marrakech-Safi, Morocco"
521,Arabesque,4.5,"4 E 36th St, New York City, New York"
522,RESTAURANT DOUYRIA,4.5,"Avenue Mohamed V, Ouarzazate, Draa-Tafilalet, Morocco"
523,Fire a& Stone,3.5,"31-32 Maiden Lane, London, England, United Kingdom"
524,Rocky Star Cocktail Bar,4.5,"Senapati Bapat Marg, Mumbai, Maharashtra, India"
525,Restaurant Palais Arabe,4,"2, Place Jamaa El Fna, Medina, Marrakech, Marrakech-Safi, Morocco"
526,La Taverne,4,"23, Bd Mohamed Zerktouni, Marrakech, Marrakech-Safi, Morocco"
527,Le Markech,4,"279 Avenue Mohammed VI, Marrakech, Marrakech-Safi, Morocco"
528,Cafe Restaurant Bladna,4,"Km 6 Route d'Ourika, Marrakech, Marrakech-Safi, Morocco"
529,El Bahia,4,"37 Wicklow Street, Dublin, County Dublin, Ireland"
530,Sky 5,4,"Boulevard Mohammed VI, Marrakech, Marrakech-Safi, Morocco"
531,Palais Dar D'mana,4,"1 rue Marrakech Medina, Marrakech, Marrakech-Safi, Morocco"
532,Sahara Marocain,4,"35, Rue Sidi Abdel Aziz Riad Laarousse, Marrakech, Marrakech-Safi, Morocco"
533,IL y a un Restaurant,4,"Rue Mauritanie, Marrakech, Marrakech-Safi, Morocco"
534,Cafe Restaurant l'Etoile,3.5,"49 rue Bab Agnaou, Marrakech, Marrakech-Safi, Morocco"
535,Cappucino,3.5,"Avenue Echouhada, Marrakech, Marrakech-Safi, Morocco"
536,La Petite Gorge Restaurant,4.5,"2 km Avant Les Gorge de Todgha, Tinerhir, Souss-Massa, Morocco"
537,Le Bled,3.5,"Kennaria 6 Djemaa el Fna, Marrakech, Marrakech-Safi, Morocco"
538,S Bar Sports Lounge,2.5,"Sport lounge, rue Oum Errabia, Marrakech, Marrakech-Safi, Morocco"
539,Les Maitres du Pain,3,"Victor Hugo, Marrakech, Marrakech-Safi, Morocco"
540,Les Maitres du Pain,3,"Victor Hugo, Marrakech, Marrakech-Safi, Morocco"
541,Red Garden,2.5,"7 AV Allal AL Fassi Imm EL Omairi, Marrakech, Marrakech-Safi, Morocco"
542,Oliveri,3.5,"Carre Eden, Marrakech, Marrakech-Safi, Morocco"
543,SOME - slow concept store,5,"76 Boulevard Mansour Edhabi, Marrakech, Marrakech-Safi, Morocco"
544,kartell kollektiv.,5,"Rue Halab 14, Marrakech, Marrakech-Safi, Morocco"
545,Cafe Bibliotheque,4.5,"Marrakech Medina, souk area, Marrakech, Marrakech-Safi, Morocco"
546,Da Nayla Pizzeria,5,"15 bis rue Mohamed El Bequal, Marrakech, Marrakech-Safi, Morocco"
547,La Recette,5,"Imm N_3 Boulvard Yacoub, Marrakech, Marrakech-Safi, Morocco"
548,La Tangeroise,4.5,"Rue Riad Zitoun El Kedim, Marrakech, Marrakech-Safi, Morocco"
549,La Marrakech Gris,5,"Avenue 29 Fevrier, Agadir, Souss-Massa, Morocco"
550,Soleil de Marrakech,4.5,"32 B route de Chinon, Noyant-de-Touraine, Sainte-Maure-de-Touraine, Indre-et-Loire, Centre-Val de Loire, France"
551,Rotisserie de la Paix,4.5,"68 Rue Yougoslavie, Marrakech, Marrakech-Safi, Morocco"
552,Dar Isselday,5,"Douar tisselday - ouarzazate maroc, Ouarzazate, Draa-Tafilalet, Morocco"
553,ArrozBar,5,"Rue Moulay Ali, Marrakech, Marrakech-Safi, Morocco"
554,Cafe-Restaurant Assanfou,4.5,"N9, Ait Azzi, Marrakech-Safi, Morocco"
555,Tierra y Mar,4.5,"99 Rue Mohamed El Bakkal, Marrakech, Marrakech-Safi, Morocco"
556,Pikala Cafe,4.5,"139 Arset Aouzal Rd, Marrakech, Marrakech-Safi, Morocco"
557,Brunch Terrasses,4.5,"Numero 1, Imm 10 Rue Camille Cabana, Marrakech, Marrakech-Safi, Morocco"
558,Marrakchiya,5,"N_ 109 Rue Azbezt, Marrakech, Marrakech-Safi, Morocco"
559,AYASO Medina,4.5,"Rahba Kedima 168, Marrakech, Marrakech-Safi, Morocco"
560,Food On Demand,4.5,"78 Boulevard Abdelkrim El Khattab, Marrakech, Marrakech-Safi, Morocco"
561,Le Canot Restaurant Marrakech,5,"Route de Casablanca, Marrakech, Marrakech-Safi, Morocco"
562,"Restaurant Anna & Paolo, Tanger",4.5,"Avenue Lafayette angle Prince Heritier, Tangier, Tanger-Tetouan-Al Hoceima, Morocco"
563,Menthe & Safran,4.5,"Rue de l'Enseignement 49, Brussels, Belgium"
564,Sushiko,4,"Gueliz Rue El Imam Malik, Marrakech, Marrakech-Safi, Morocco"
565,Marrakech,3.5,"Block 86, 90th Street, 5th Settlement, Cairo, Cairo Governorate, Egypt"
566,Billys Burger Marrakech,4,"15 rue Imam Chafii, Marrakech, Marrakech-Safi, Morocco"
567,Aqua Pazza,3.5,"89 Angle Av Mohamed V & Bd Zerktouni, Marrakech, Marrakech-Safi, Morocco"
568,Pousse-Pousse,3.5,"Marrakech, Marrakech-Safi, Morocco"
569,Le Jardin des Aromes,4.5,"69 Avenue Mohamed V, Ouarzazate, Draa-Tafilalet, Morocco"
570,Kaiss Kitchen,5,"69 Derb Jdid, Riad Zitoun Kedim, Marrakech, Marrakech-Safi, Morocco"
571,CoteSud,4.5,"Bp 710, Ouarzazate, Draa-Tafilalet, Morocco"
572,Nommos,4.5,"Boulevard Mohamed 6, Marrakech, Marrakech-Safi, Morocco"
573,Restaurant & Bar Dar Justo,4.5,"35, Derb Chorfa Lakbir, Marrakech, Marrakech-Safi, Morocco"
574,Delice Ferkouss,4,"Avenue Hassane 2, Marrakech, Marrakech-Safi, Morocco"
575,Marrakech,4.5,"1413 N Ashland Ave, Chicago, Illinois"
576,Riad Marrakech 2,4.5,"9 Avenue Sylvain Marian, Lacanau-Ocean, Lacanau, Gironde, Nouvelle-Aquitaine, France"
577,Mamita Marrakech,4.5,"Carretera Arenal 54, El Arenal, Majorca, Balearic Islands, Spain"
578,Patashou,4,"12, Residence Jacaranda-Gueliz-Marrakech- En Face de la Clinique Chifaa, Marrakech, Marrakech-Safi, Morocco"
579,La Maison du Poulet,4,"Angle Avenue Mohamed VI et Route Targa, Marrakech, Marrakech-Safi, Morocco"
580,Restaurante Marrakesh,4,"Calle Verger 1, Valencia, Province of Valencia, Valencian Community, Spain"
581,Cafe Las Torres De Majorelle,4,"Avenue Yacoub El Mansour, Marrakech, Marrakech-Safi, Morocco"
582,Charif Patisserie Restaurant,4,"Rue Oued El Makhazine Magazine 1, Marrakech-Safi, Morocco"
583,Le Caspien,4,"12 Rue Lobnane, Marrakech, Marrakech-Safi, Morocco"
584,L’atelier des Saveurs,4,"Avenue El Glaoui, Marrakech, Marrakech-Safi, Morocco"
585,Domaine Royal Palm,4,"Km 12 Route d'Amizmiz BP 2470 Marrakech, Marrakech, Marrakech-Safi, Morocco"
